DateTime,News
2007-08-20 04:42:00,Cosan\'s Sugar-Free Debut
2007-09-10 08:19:00,IPO Report: Brazilian sugar giant Cosan raises $1.2 billion in NYSE IPO
2007-09-17 02:08:00,Latin America to Rise From the Ashes of the Credit Debacle
2007-09-28 04:37:00,5 Hot IPOs
2007-09-28 05:04:00,IPOs Raise $11.3 Billion in 3rd Quarter
2007-09-28 06:02:00,"IPO Roundup: China Digital, Memsic"
2007-10-11 06:53:00,Janus Capital Management liquidates stake in Molex
2007-10-18 11:32:00,Coke\'s Profits Cool
2007-11-22 02:46:00,Look Out For Winners In the Transition from Petroleum
2007-12-16 03:02:00,Cosan Limited F2Q08 (Qtr End 10/31/07) Earnings Call Transcript
2007-12-19 10:58:00,Gushan Environmental Shares Gain
2007-12-26 11:43:00,CZZ Valuation High
2007-12-31 05:14:00,Ethanol Growth Faces Tremendous Obstacles
2008-01-07 04:33:00,Brazil\'s BNDES buys sugar miller Santelisa stake
2008-01-08 02:21:00,Outlook for renewable energy stocks in 2008
2008-01-09 04:48:00,Brazil listed sugar companies climb on ICE rally
2008-01-14 08:10:00,5 Must-Read Stories in Oil and Alternative Energy
2008-01-18 01:05:00,Sector Snap: Ethanol Shares Mostly Fall
2008-01-18 05:16:00,GAO Calls for Global Biofuel Standards
2008-01-22 10:17:00,Out of the Gate: Renewable Energy Falls
2008-01-30 03:35:00,Sector Glance: Renewable Stocks Mixed
2008-03-04 11:59:00,Sector Snap: Ethanol Stocks Plummet
2008-03-05 09:18:00,"Brazil Cosan to try share swap, delisting again"
2008-03-05 12:38:00,Sector Snap: Bargain Hunt Helps Ethanol
2008-03-10 07:04:00,"Pops & Drops: Reynolds, Citigroup..."
2008-03-12 03:34:00,Cosan\'s Short-Term Outlook Unsure
2008-03-13 01:03:00,Sector Snap: Ethanol Drops on Outlook
2008-03-14 01:50:00,Cosan says Brazil to use more cane for sugar
2008-03-14 02:39:00,CORRECTED - Cosan says Brazil to use more cane for sugar
2008-03-25 01:17:00,Cosan Trading at a High P/E
2008-03-28 11:53:00,IPO Report: Alternative energy pipeline empty after IPOs hit rough patch
2008-03-31 01:44:00,Sector Snap: Ethanol Shares Decline
2008-04-08 09:08:00,An Overview of Peru\'s Stock Market
2008-04-09 05:40:00,[video] Stock Pops & Drops
2008-04-17 02:55:00,More Ethanol in the Pipeline
2008-04-21 09:56:00,The Long Case for Sugar-Based Brazilian Ethanol Producer Cosan Limited
2008-04-24 02:19:00,Cosan Ltd. buys Exxon Mobil Brazil distribution for $1 bln
2008-04-24 08:31:00,Cosan buys Exxon\'s assets in Brazil for $826 mln
2008-04-24 08:58:00,UPDATE - Cosan buys Exxon\'s assets in Brazil for $826 mln
2008-04-29 03:36:00,Archer\'s Blazing Arrow
2008-04-29 12:20:00,Brazilian Fuel Moves
2008-05-07 07:05:00,Short-Term Outlook To Help Agri Sector
2008-05-13 05:51:00,World Market for Biofuels Expected to Double
2008-05-26 08:03:00,Ethanol boom brings change to Brazil cane growers
2008-06-03 09:55:00,Tomorrow\'s Monster Stocks
2008-06-16 12:11:00,Is Sugar-Based Ethanol a Sweet Deal?
2008-06-26 12:15:00,S&P eyes \'political event risk\' for ethanol
2008-07-01 06:41:00,Latin American Markets: Brazil loses ground; Mexican inflation outlook increases
2008-07-18 05:41:00,Five Ethanol Plays To Know For July 18
2008-07-31 11:59:00,Brazil\'s Cosan sees record 2008/09 ethanol exports
2008-07-31 12:50:00,"Sugar, ethanol prices to rise in 08/09 - Cosan"
2008-08-06 10:35:00,Cosan Brazilian Ethanol a Hold
2008-08-08 03:21:00,Sugar Supply Concerns Developing: Affect on Commodity Markets
2008-08-26 03:08:00,UPDATE - Brazil\'s Cosan and US group in sugar farmland deal
2008-09-09 02:48:00,Latin American Markets: Brazil stumbles to 18-month low as commodities fall; Mexico drops
2008-09-09 07:11:00,Latin American Markets: Brazil stumbles to 17-month low as commodities fall; Mexico drops
2008-09-09 08:30:00,"Controversy, Benefits of Brazilian Sugarcane Based Ethanol Chemicals and Fuels"
2008-09-12 01:05:00,Stronger US dollar to trim sugar price rise-Cosan
2008-09-16 02:34:00,Making Cents in Penny Stocks
2008-09-20 09:04:00,COSAN LTD. Financials
2008-09-22 04:32:00,Brazil Cosan eyes share swap in next ethanol deals
2008-09-23 06:54:00,Latin American Markets: Equities fall as U.S. bailout plan shoved under microscope
2008-09-23 09:26:00,TSC Ratings\' Updates: HCC Insurance
2008-09-23 09:30:00,InPlay: Cosan: Moody\'s downgrades Cosan\'s ratings to Ba3/A3.Br; outlook negative
2008-09-30 03:07:00,Latin American Markets: Equities bounce higher after steep day-ago declines
2008-09-30 09:06:00,"Latin American Markets: Equities bounce higher but log monthly, 3Q declines"
2008-10-01 09:15:00,Brazil\'s Cosan Downgraded to Sell
2008-10-01 12:41:00,Brazil\'s ALL to ship Cosan ethanol to port by rail
2008-10-06 04:56:00,"Inergy Holdings, North American Energy Partners and Hiland Holdings among 52-week lows"
2008-10-09 10:13:00,Brazil Cosan says stronger dollar raising revenues
2008-10-10 05:01:00,Sugar Futures Drop; Fundamental Picture Currently Ignored
2008-10-22 12:51:00,Cosan downgraded by Deutsche Securities
2008-10-23 05:00:00,"Cosan, Spartan Motors: Biggest Price Gainers (CZZ, SPAR)"
2008-10-27 03:12:00,The Wall Street Myth That Could Destroy Your Portfolio
2008-10-28 02:57:00,"Latin American Markets: Brazilian, Mexican stocks on track to snap losing streak"
2008-11-22 06:07:00,[$$] 13D Filings
2008-12-12 03:26:00,Latin American Markets: Equities off lows as investors watch U.S. auto developments
2008-12-15 12:10:00,Brazil\'s Cosan Upgraded to Hold
2008-12-26 01:58:00,4-Star Stocks on the Upswing
2009-01-12 02:58:00,10 Green Energy Gambles for \'09
2009-08-20 05:33:00,Shocking Sugar Shortage
2009-08-20 08:56:00,\'Fast Money\' Recap: The Rally Continues
2009-08-24 12:32:00,Today\'s 5-Star Movers
2009-08-30 08:19:00,Sugar Prices Reflect a Commodity Rife with Regulation
2009-08-31 12:57:00,A Big Upgrade for Cosan
2009-09-01 05:03:00,"Sugar: It\'s Like AIG, Except We Actually Need It"
2009-09-18 02:38:00,5-Star Stocks on the Upswing
2009-09-25 01:35:00,"Wind Power Currently $0.06 Per KiloWatt Hour, Southern California Solar Power At $0.21 To $0.22/kWh: Natural Gas Must Double In Price For Cost Parity Without Government Subsidy According To Industry Expert"
2009-09-25 02:05:00,5 Stocks Bouncing Back
2009-10-09 03:37:00,10 Green Energy Gambles: A Q3 Update
2009-10-09 07:18:00,Brazil: The Only Market Worth Investing In
2009-10-19 02:52:00,3 Stocks Hitting High Notes
2009-10-20 10:55:00,Brazil\'s Cosan sees 2010/11 cane crush at 58 mln T
2009-10-20 11:28:00,UPDATE - Brazil\'s Cosan sees 2010/11 cane crush at 58 mln T
2009-10-21 10:06:00,Brazil sugar-ethanol sector emerging from crisis
2009-10-27 09:39:00,"UPDATE - Dreyfus takes over Brazil\'s Santelisa, plans IPO"
2009-10-27 12:51:00,Investing in Brazilian companies
2009-10-28 05:51:00,Latin American Markets: Brazil drops; Mexico hurt as Cemex shares slide
2009-11-05 05:29:00,Betting On Brazil\'s Future
2009-11-09 02:06:00,Cosan chairman settles dispute with Brazil\'s CVM
2009-11-11 10:00:00,SmallCapSentinel.com: Green Energy Technology Report Released
2009-11-13 07:13:00,Brazil\'s Cosan posts July-Sept 173 mln reais net
2009-11-17 11:24:00,3 Stocks With 25% Sales Growth
2009-11-19 05:34:00,Latin American Markets: Brazilian stocks down as new tax is levied
2009-11-20 07:30:00,"Lightning Round: Las Vegas Sands, ADC Telecom, Satyam Computer and More"
2009-11-24 02:50:00,2 Stocks Hitting High Notes
2009-12-01 05:51:00,Corn Delay: EPA Puts Off Decision on Upping Ethanol Blend
2009-12-01 12:32:00,Equity Plays on Potential Ethanol Boost
2009-12-02 03:46:00,Brazil Cosan buys Petrosul gas stations - report
2009-12-08 01:33:00,"Amyris to join Bunge, Cosan in cane bio-chemicals"
2009-12-08 04:15:00,Biomass Players\' Turn to Feed at the Trough
2009-12-14 01:26:00,Brazil\'s Cosan buys Petrosul filling stations
2009-12-15 11:44:00,Ethanol Stocks Advance as Energy Giant Ups Exposure
2009-12-22 02:49:00,Don\'t Stop Brazil Now
2009-12-24 03:29:00,UPDATE - Bunge doubles Brazil sugar bet with $452 mln deal
2009-12-24 12:42:00,UPDATE - Bunge makes big Brazil sugar bet in $452 mln deal
2009-12-29 05:05:00,[$$] Brazil ETF Set Up for Another Big Year
2009-12-30 08:08:00,"Stock Picks: Allstate, H&R Block"
2010-01-07 04:25:00,Cosan: A Sweet Play on Rising Sugar Prices
2010-01-07 04:52:00,Brazil BNDES freezes loans to sugar group Cosan
2010-01-07 05:55:00,UPDATE - Brazil BNDES freezes loans to sugar group Cosan
2010-01-07 08:57:00,"Latin American Markets: Cosan, cable firm drag down Brazil stock index"
2010-01-07 10:19:00,Another Ethanol Player Back From the Dead
2010-01-08 04:57:00,Wal-Mart suspends contract with Brazil\'s Cosan
2010-01-11 04:09:00,Brazil state bank BNDES to resume loans to Cosan
2010-01-11 04:40:00,UPDATE - Cosan hopes customers will return after ban lifted
2010-01-12 03:38:00,Brazil office seeks to keep Cosan on black list
2010-01-19 03:32:00,Brazil opens world\'s first ethanol-fired power plant
2010-01-26 11:24:00,UPDATE - Australia CSR rejects $1.4 bln Chinese sugar offer
2010-01-27 02:00:00,CORRECTED - CORRECTED-UPDATE - Australia CSR rejects $1.4 bln China sugar of
2010-03-02 10:16:00,1-Star Stocks Poised to Plunge: Green Plains?
2010-03-09 07:39:00,Coverage initiated on Cosan by Citigroup
2010-03-11 06:11:00,Cosan: A Brazilian Refiner That\'s Sweeter than Gisele
2010-03-23 03:23:00,"How to Turn $25,000 Into $3.2 Million"
2010-03-26 10:34:00,5-Star Stocks Poised to Pop: Cosan
2010-04-06 12:38:00,[video] Taming The Tigers [1.2 min]
2011-03-02 08:17:00,Cosan sees savings of 3.4 bln reais with Shell JV
2011-03-02 10:48:00,UPDATE 1-Cosan sees $2 bln of savings in Shell venture
2011-03-02 12:56:00,Rising Oil Boosts The Fortunes Of Biofuel Stocks
2011-03-10 07:02:00,Sugar Rush: Touring a Billionaire\'s Sugarcane Mill in Brazil
2011-03-11 04:00:00,"[$$] Rob\'s Wrap: Dollar/Yen, LSI, CZZ"
2011-03-11 10:35:00,"FACTBOX-Mergers, takeovers in Brazil\'s ethanol industry"
2011-03-22 01:40:00,"US Brazil Biofuels Talk Helps Cosan, But India Could Change That"
2011-03-23 10:56:00,Brazilian Alcohol Producer Thirsty For More Profits
2011-03-31 02:45:00,The Ethanol Conundrum Continues
2011-03-31 10:41:00,Is Cosan Earning Enough for You?
2011-04-06 12:38:00,UPDATE 1-Brazil ethanol shares down on regulatory concerns
2011-04-07 01:41:00,NYSE stocks posting largest percentage decreases
2011-04-07 09:30:00,"Fitch Raises Brazil Debt Rating, but Currency Strength Poses Problem for US, Chinese Exporters"
2011-04-15 12:31:00,5 Agriculture Stocks That Pay Dividends
2011-04-19 12:08:00,5 Agriculture Stocks You Need To Know
2011-04-20 06:37:00,It\'s Time To Invest In Brazil
2011-04-26 09:49:00,4-Star Stocks Poised to Pop: Cosan
2011-04-28 08:59:00,Equity Research on Cosan Ltd. and Hershey Co. -- A Tale of Two Confectioners
2011-04-28 09:48:00,"Brazil May Reduce Ethanol Blend Rate for Gasoline, Valor Says"
2011-05-06 05:25:00,Buying Brazil IV: The Best of the Rest
2011-05-11 01:51:00,The U.S. Ethanol Story Gets Interesting
2011-05-12 10:21:00,Petrobras Underperforming Oil On Govt Gas Price Intervention
2011-05-12 12:11:00,Brazil Govt Intervenes on $6.82 Per Gallon Gasoline Prices
2011-05-17 04:47:00,Is It Time To Invest Abroad
2011-05-18 04:06:00,Buying Brazil (Part VI): Assessing Country Risk
2011-05-19 04:45:00,Cosan Replaces Old Debt with New
2011-05-24 06:00:00,"5 Stocks to Bet on Farming, Like Soros Does"
2011-05-24 07:18:00,Four Overlooked Agriculture Stocks
2011-05-26 04:53:00,Brazil Turns to U.S. to Meet Ethanol Demands
2011-05-31 11:30:00,Cosan Announces Preliminary Results
2011-06-01 09:01:00,Equity Research on Cosan Ltd. and Hershey Co. - Confectioners Deal With High Sugar Prices
2011-06-01 10:38:00,Hershey (HSY) Showing Limited Impact As Rising Cost Inflation Hits The Food Industry; Less Than 1% Of Confectionary Market Is Private Label According To Equity Analyst
2011-06-02 01:34:00,Cosan raises debt transferred to JV with Shell
2011-06-02 10:19:00,4-Star Stocks Poised to Pop: Archer Daniels Midland
2011-06-03 01:15:00,"Shell, Cosan Launch Raizen"
2011-06-07 05:21:00,RPT-UPDATE 1-Brazil ethanol mills see costs as key to survival
2011-06-07 06:00:00,5 Agriculture Stocks To Grow With
2011-06-07 07:52:00,Brazil\'s Cosan profit rises 64 percent
2011-06-07 09:59:00,UPDATE 1-Brazil\'s Cosan Q4 net profit rises 64 percent
2011-06-13 03:30:00,Cosan Upgraded to Neutral
2011-06-15 02:21:00,"Ethanol Wins The Battle, Not The War"
2011-06-16 11:30:00,U.S. Stock Options With Biggest Changes in Implied Volatility
2011-06-17 02:24:00,Ethanol Steps to the Ledge
2011-06-17 12:03:00,Shame on Indiana ... but Not Just Indiana
2011-06-24 06:51:00,Largest NYSE Short Interest Percent Increases as of June 15
2011-07-01 03:28:00,Why Did My Stock Just Die?
2011-07-01 09:06:00,Equity Research on Cosan Ltd. and Hershey Co. - Confectioners Could See Sugar High Go Higher
2011-07-09 04:36:00,Corn Will Rise Despite Subsidy Woes
2011-07-15 03:40:00,Council on Foreign Relations to US: Move Closer to Brazil
2011-07-19 03:45:00,Ways To Invest In A Growing Brazil
2011-07-20 11:31:00,"Sugar Prices on the Rise, Thanks to Brazil"
2011-07-29 12:01:00,Investing Abroad: Five Non-American Companies
2011-08-02 08:56:00,"Equity Research on Cosan Ltd. and Hershey Co. - Sugar High, Mixed Bag for Confectioners"
2011-08-11 10:35:00,Fresh Del Monte Produce Goes Ex-Dividend
2011-08-15 10:42:00,Highbridge Capital Management Holdings in 2nd Quarter: 13F Alert
2011-08-16 07:37:00,Brazil\'s Cosan posts net profit of $1.44 bln
2011-08-16 09:23:00,Brazil\'s Cosan posts net profit of $1.44 billion
2011-08-17 02:33:00,ADR Report-Strong US retailer profits lift foreign shares
2011-08-17 03:56:00,5 Bullish Macd Crossovers
2011-08-17 08:39:00,"UPDATE 1-Petrobras, Sao Martinho to expand ethanol output"
2011-08-17 11:00:00,Cosan Posts Impressive 1Q
2011-08-18 06:07:00,UPDATE 1-Bunge $2.5 bln Brazil investment to raise crush
2011-08-25 02:10:00,Big Ethanol Refiners Will Weather The Storm Of Congress\' Eventual Subsidy Cuts
2011-09-01 08:15:00,Research on Cosan Ltd. and Hershey Co. - Complicated Inputs for Confectioners
2011-09-01 12:49:00,2 Great Plays In Sugarcane Ethanol
2011-09-07 01:53:00,Sophisticated Investors Think These 10 Stocks Will Outperform the Downturn
2011-09-09 06:33:00,Latin American Markets: Brazil stocks slide as European troubles dominate
2011-09-15 11:15:00,Cosan Downgraded to Underperform
2011-09-16 09:45:00,Is Archer Daniels Midland the Right Stock to Retire With?
2011-09-21 11:30:00,Biodiesel Stocks: Will Investors Keep Ignoring Biodiesel\'s Revival?
2011-09-23 07:00:00,10 Cheap Stocks The Bottom Line Off Their Highs
2011-09-23 07:00:00,10 Cheap Stocks Below Their Recent Highs
2011-09-28 03:06:00,Brazil could add 200 mln T cane in 2 yrs-Cosan
2011-09-28 06:40:00,Cosan to Buyback $100M Stock
2011-10-03 08:15:00,Equity Research on Cosan Ltd. and Hershey Co. - Positive Signs for Confectioners
2011-10-06 05:07:00,The Most Promising Dividends in Agricultural Products
2011-10-13 07:06:00,Zacks #5 Rank Additions for Thursday
2011-10-14 11:49:00,"5 Agriculture Stocks To Consider Over The Weekend (MON, CZZ, AGU, DE, TSCO)"
2011-10-19 01:36:00,Profiting From Emerging Middle Class Demand For Sugar
2011-10-20 02:03:00,"Amyris, ETH Bioenergia to Make Fuel Precursor in Brazil"
2011-10-20 10:58:00,Amyris teams up with ETH to expand Brazil ops
2011-10-20 11:20:00,Has Cosan Become the Perfect Stock?
2011-10-21 08:07:00,Cosan aquires more ExxonMobil assets in S.America
2011-10-25 02:59:00,Imperial Sugar: Overblown Fears Create Opportunity
2011-11-07 05:30:00,Cosan to Buyback 2.6M Stock
2011-11-07 11:45:00,Ups And Downs Par For The Course At ADM
2011-11-09 07:18:00,Q2 2012 Cosan Ltd Earnings Release - After Market Close
2011-11-10 11:15:00,"CZZ\'s 2Q Net Dips, Topline Up"
2011-12-22 01:15:00,European Turmoil Stalls The Emerging Market Growth Trend
2012-01-03 06:58:00,Expect Decoupling: Buy Agriculture And Short Industrial Metals
2012-01-04 02:26:00,Cosan Could Look A Little Sweeter In 2012
2012-01-11 07:58:00,Largest NYSE Short Interest Percent Decreases as of Dec. 30
2012-01-12 11:54:00,5 Best Alternative Energy Investments Now
2012-01-15 09:18:00,One Reason To Invest In Cosan: Sugar\'s New Markets
2012-01-17 03:09:00,Buy Cosan: Big Winner From The Removal Of US Ethanol Subsidies
2012-01-21 09:23:00,Sugar Rally Powered By Ethanol
2012-01-23 10:39:00,Get Ready for Higher Sugar Prices
2012-01-24 06:58:00,Bunge: An Agribusiness Conglomerate With Few Peers
2012-01-24 08:20:00,US Ethanol Companies Facing Growing Competition From Brazilian Competitors
2012-01-27 05:14:00,5 Agriculture Stocks With Dividends
2012-01-27 06:42:00,Energy Common Sense: Butanol vs. Ethanol
2012-01-27 10:48:00,Brazil: Investing In A Stable Democracy Growing Exponentially
2012-03-01 08:18:00,Brazil\'s Cosan buys UK lubricants firm from Exxon
2012-03-09 01:15:00,Cosan Expands Lubricant Business
2012-03-09 06:11:00,Largest NYSE Short Interest Percent Decreases as of Feb. 29
2012-03-12 08:05:00,Equity Research on Cosan Ltd. and Hershey Co. - Sugar Prices Affecting Confectioners Differently
2012-03-15 08:20:00,U.S. Ethanol Industry Poised for Growth as Brazilian Output Falls
2012-03-29 02:25:00,Latin American Stocks: Trading on Rapid Regional Growth
2012-04-12 02:46:00,BG in sale talks over Brazil gas distributor
2012-04-12 04:31:00,Thursday\'s Bio-Tech Cataylst Watch: 2 Buys
2012-04-13 08:20:00,Equity Research on Cosan Ltd. and Hershey Co. - Confectioners All Smiles on Increased Demand for Sugar and Chocolate
2012-04-16 03:23:00,Codexis: Building Environmentally Successful Profits
2012-04-16 05:02:00,Top Value Picks In The BRICs For Week Of Apr 16
2012-04-23 12:10:00,Hershey Hits a 52-Week High: Is It Still a Delicious Buy?
2012-04-29 04:39:00,Why Latin America Can Resolve The World\'s Protein Imbalance
2012-05-01 10:19:00,"Sugar Glut Good News For Consumers, Bad News For Shareholders"
2012-05-03 05:26:00,BG agrees $1.8bn sale in Brazil
2012-05-09 07:00:00,Brazils $2 Billion Cane Revival Plan Fails: Commodities
2012-05-10 02:46:00,Brazil: A sustainable sugar rush
2012-05-16 08:05:00,Equity Research on Cosan Ltd. and The Hershey Co. - Confectioners Making Positive Moves
2012-05-18 09:42:00,Brazil No Longer a Sweet Investment
2012-05-18 09:51:00,Neil Hennessy\'s No-Nonsense Investing Strategy
2012-05-20 08:43:00,How to Profit from the World\'s Sweet Tooth
2012-05-23 02:42:00,Has Andersons Become the Perfect Stock?
2012-05-30 02:41:00,"Companies reporting After the Market Close on Wednesday, May 30"
2012-05-30 07:07:00,Q4 2012 Cosan Ltd Earnings Release - After Market Close
2012-05-30 09:00:00,"Upcoming Economic Outlook - Report Highlights Cosan Limited(ADR) and Aruba Networks, Inc."
2012-05-31 06:31:00,Brazil\'s Cosan net profit falls to 149.6 mln reais
2012-05-31 07:33:00,UPDATE 1-Brazil\'s Cosan qtrly net plummets 69 pct
2012-05-31 11:15:00,Cosan Reports Weak 4Q
2012-05-31 11:32:00,5 Agriculture Stocks To Buy
2012-06-01 04:07:00,Invest Abroad: Non-American Companies Worth Looking At
2012-06-06 11:06:00,Cosan Beats Expectations but Takes a Step Back Anyway
2012-06-07 11:15:00,Cosan Downgraded to Neutral
2012-06-11 08:20:00,Cosan and BioFuel Energy Look to Benefit from Falling Corn Prices
2012-06-29 10:31:00,On The Fly: Analyst Upgrade Summary
2012-07-05 11:00:00,Cosan Completes Comma Acq.
2012-07-09 11:55:00,"Don\'t Sweat China, Jump On Metals And Rising Estimates"
2012-07-19 05:18:00,Soaring Corn Prices Translate Into Opportunity For These Companies
2012-07-26 04:00:00,Billionaire Glenn Dubin\'s Top 5 Picks Paying Dividends
2012-07-27 08:20:00,Soaring Corn Prices Affecting Ethanol Companies\' Profit Margins
2012-07-31 03:11:00,7 Value Stocks Fund Managers Are Betting Big On
2012-08-07 02:40:00,How a Free Codexis Can Elbow its Way to the Top
2012-08-08 07:07:00,Q1 2013 Cosan Ltd Earnings Release - After Market Close
2017-03-10 07:11:00,Buy These 5 Best Value Stocks to Make the Most of P/B Ratio
2017-03-14 09:31:00,New Strong Buy Stocks for March 14th
2017-03-17 08:14:00,"Cosan S.A. Industria e Comercio -- Moody\'s affirms Cosan\'s Ba2 corporate family rating, upgrades national scale ratings; changes outlook to stable"
2017-03-17 08:31:00,Cosan Overseas Limited -- Moody\'s takes action on Cosan\'s ratings
2017-03-17 10:09:00,5 Solid Stocks Making the Most of March Madness
2017-03-20 05:12:00,Cosan S.A. Industria e Comercio -- Moody\'s takes action on Cosan\'s ratings
2017-03-20 09:30:00,"The Zacks Analyst Blog Highlights: Berkshire Hathaway, Huntington Ingalls Industries, Bravo Brio Restaurant Group, Children\'s Place, MYR Group and Cosan"
2017-03-21 03:59:00,PEG Ratio vs. the P/E Ratio
2017-03-21 04:49:00,Why You Need to Buy Today\'s Stock Market Dip
2017-03-21 08:07:00,"Cosan Ltd. breached its 50 day moving average in a Bullish Manner : CZZ-US : March 21, 2017"
2017-03-22 08:19:00,5 Cheap PEG Picks for Value Investors Right Now
2017-03-22 09:30:00,"Zacks Investment Ideas feature highlights: Burlington Stores, Best Buy, Dycom, Cosan and Telefonica"
2017-03-24 10:49:00,4 Low P/CF Stocks to Add More Value to Your Investment
2017-03-27 09:32:00,"Zacks.com featured highlights: Tech Data, Cosan, Fiat Chrysler Automobiles N.V. and Applied Materials"
2017-03-28 07:08:00,Buy These 5 Stocks with Low P/B Ratio to Boost Returns
2017-03-29 09:54:00,Add These 5 High Earnings Yield Stocks to Your Portfolio
2017-03-30 09:30:00,"Zacks.com featured highlights: Tech Data, United Insurance Holdings, VALE S.A., Cosan and Volkswagen Aktiengesellschaft"
2017-03-31 08:34:00,"Cosan Ltd. breached its 50 day moving average in a Bearish Manner : CZZ-US : March 31, 2017"
2017-04-06 09:03:00,Cosan Limited\'s (CZZ) Growth Potential Solid: Time to Buy?
2017-04-12 08:24:00,Why is P/B Ratio a Great Valuation Metric?
2017-04-13 08:17:00,"Cosan Ltd. breached its 50 day moving average in a Bearish Manner : CZZ-US : April 13, 2017"
2017-04-13 11:37:00,Top 4 Sugar Stocks of 2017
2017-04-17 01:25:00,"Cosan Ltd.  Value Analysis (NYSE:CZZ) : April 17, 2017"
2017-04-18 08:36:00,Looking for Value? Why It Might Be Time to Try Cosan (CZZ)
2017-04-19 02:51:00,Brazil\'s Economic Activity Hits Fastest Pace in 8 Years: 4 Picks
2017-04-20 08:38:00,Should Cosan (CZZ) Be On Your Radar Now?
2017-04-20 09:30:00,"The Zacks Analyst Blog Highlights: Cosan, Itau Unibanco Holding, Banco Bradesco and Ultrapar Participacoes"
2017-05-01 07:00:00,Bull of the Day: Cosan (CZZ)
2017-05-01 09:30:00,"Cosan, CDW and Apple highlighted as Zacks Bull and Bear of the Day"
2017-05-04 08:25:00,5 Stocks Flaunting Enticing EV/EBITDA Ratios to Buy Now
2017-05-11 05:50:00,Cosan posts 1Q profit
2017-05-11 06:56:00,"Cosan (CZZ) Q1 Earnings Fall Y/Y on Weak Sales, Margins"
2017-05-15 11:01:00,Top Ranked Value Stocks to Buy for May 15th
2017-05-16 08:10:00,"Cosan Ltd. breached its 50 day moving average in a Bullish Manner : CZZ-US : May 16, 2017"
2017-05-18 12:36:00,"Why Cia Energetica de Minas Gerais, Companhia Siderurgica Nacional, and Everything Else in Brazil Are Falling Apart Today"
2017-05-19 06:31:00,"Why Gerdau, Cosan, and Companhia Siderurgica Nacional Stocks Soared Today"
2017-05-19 08:38:00,Why The Andersons (ANDE) Could Be Positioned for a Slump
2017-05-19 12:00:00,"Cosan Ltd. : CZZ-US: Dividend Analysis : May 18th, 2017 (record date) : By the numbers : May 19, 2017"
2017-05-25 10:20:00,Top Ranked Value Stocks to Buy for May 25th
2017-06-01 05:56:00,Cosan S.A. Industria e Comercio -- Moody\'s affirms Cosan\'s Ba2 corporate family rating; changes outlook to negative
2017-06-01 06:11:00,Curzon Funding Limited Series 2006-3 (Horizon CDO VIII) -- Moody\'s affirms Cosan\'s ratings; changes outlook to negative
2017-06-06 01:57:00,Cosan Luxembourg SA -- Moody\'s affirms Cosan\'s ratings; changes outlook to negative
2017-06-06 10:54:00,Top Ranked Value Stocks to Buy for June 6th
2017-06-21 01:04:00,"Cosan Ltd. :CZZ-US: Earnings Analysis: Q1, 2017 By the Numbers : June 21, 2017"
2017-06-22 03:37:00,"ETFs with exposure to Cosan Ltd. : June 22, 2017"
2017-07-03 03:05:00,"ETFs with exposure to Cosan Ltd. : July 3, 2017"
2017-07-13 03:51:00,"ETFs with exposure to Cosan Ltd. : July 13, 2017"
2017-07-14 08:35:00,"Cosan Ltd. breached its 50 day moving average in a Bullish Manner : CZZ-US : July 14, 2017"
2017-07-17 09:20:00,"Cosan Limited\'s (CZZ) Growth Potential Solid, Runs Risks"
2017-07-31 05:54:00,"Cosan Ltd.  Value Analysis (NYSE:CZZ) : July 31, 2017"
2017-08-10 07:41:00,Cosan reports 2Q loss
2017-08-11 06:06:00,"Cosan (CZZ) Posts Profit in Q2, Maintains \'17 Guidance"
2017-08-14 08:04:00,See what the IHS Markit Score report has to say about Cosan Ltd.
2017-08-24 09:45:00,Will Cosan Limited (CZZ) Make a Suitable Value Pick Now?
2017-09-05 08:07:00,Will Oil Price Volatility Affect These Agriculture Stocks?
2017-10-02 09:10:00,"Cosan Ltd. :CZZ-US: Earnings Analysis: Q2, 2017 By the Numbers : October 2, 2017"
2017-10-03 11:09:00,"ETFs with exposure to Cosan Ltd. : October 3, 2017"
2017-10-10 08:25:00,Brazil\'s Cosan to buy Shell\'s Comgas stake for $365 million
2017-10-11 10:00:00,Cosan (CZZ) to Buy 16.8% Interest in Comgas From Shell
2017-10-16 09:50:00,"ETFs with exposure to Cosan Ltd. : October 16, 2017"
2017-11-01 09:40:00,"Zacks.com featured highlights: Kraton, Cosan, Synnex, Plains GP Holdings and Fiat Chrysler Automobiles"
2017-11-06 07:51:00,"Cosan Ltd. breached its 50 day moving average in a Bearish Manner : CZZ-US : November 6, 2017"
2017-11-07 11:07:00,"Cosan Ltd.  Value Analysis (NYSE:CZZ) : November 7, 2017"
2017-11-08 10:58:00,"Cosan Ltd. breached its 50 day moving average in a Bearish Manner : CZZ-US : November 8, 2017"
2017-11-14 08:52:00,Cosan (CZZ) Q3 Net Income Surges Y/Y on Solid Revenue Growth
2017-11-14 10:39:00,Cosan posts 3Q profit
2017-11-15 08:26:00,Here\'s Why You Should Add Cosan (CZZ) to Your Portfolio
2017-11-20 07:15:00,"Cosan Limited Announces Commencement Of Tender Offer To Repurchase Up To U.S.$200,000,000.00 Of Its Class A Common Shares At Price Not Greater Than U.S.$9.65 Nor Less Than U.S.$9.23 Per Share"
2017-11-21 06:33:00,Brazil\'s Cosan to start $200 million share buyback program on Tuesday
