DateTime,News
2017-11-21 07:40:00,"Cosan Ltd. breached its 50 day moving average in a Bullish Manner : CZZ-US : November 21, 2017"
2017-11-22 11:07:00,Cosan (CZZ) to Gain From Diversified Business Structure
2017-12-01 09:09:00,5 Value Picks With Amazingly Low EV/EBITDA Ratios
2017-12-04 08:17:00,"Zacks.com highlights: SORL Auto Parts, Cosan, American Equity Investment Life Holding, Prudential Financial and Fiat Chrysler Automobiles"
2017-12-07 08:41:00,What Falling Estimates & Price Mean for The Andersons (ANDE)
2017-12-11 07:20:00,Top Ranked Value Stocks to Buy for December 11th
2017-12-20 07:21:00,Cosan Limited Announces Preliminary Results of Its Tender Offer
2017-12-22 07:00:00,Cosan Limited Announces Final Results Of Its Tender Offer
2018-01-23 09:30:00,Is Cosan (CZZ) a Great Stock for Value Investors?
2018-03-01 10:11:00,"Zacks.com highlights: Cosan, ArcelorMittal, Legg Mason, Bed Bath & Beyond and General Motors"
2018-03-02 10:00:00,"Cosan to Host Investor Day on March 16, 2018"
2018-03-05 03:13:00,"Cosan (CZZ) Posts Net Profit for 2017, Provides \'18 View"
2018-03-07 09:11:00,Andersons (ANDE) Teams Up With ICM to Build Bio-Refinery
2018-03-20 06:58:00,Brazil\'s Cosan signs 20-year lubricant contract with Exxon in South America
2018-05-14 02:24:00,Cosan\'s (CZZ) Net Profit Expands Y/Y on Solid Sales in Q1
2018-06-05 07:55:00,Free Pre-Market Technical Pulse on Eversource Energy and Three More Utilities Stocks
2018-06-26 11:28:00,Why Did Cosan Limiteds (NYSE:CZZ) Insiders Buy Up More Shares?
2018-07-05 07:30:00,Free Technical Research on Eversource Energy and Three More Diversified Utilities Equities
2018-07-31 06:46:00,"Shell, Petrobras units probed for Brazil price-fixing"
2018-08-01 02:10:00,New Strong Sell Stocks for August 1st
2018-08-08 05:39:00,"Brazilian energy, logistics group Cosan posts 64.3 mln reais 2nd-qtr loss"
2018-08-08 06:06:00,"Brazil\'s Cosan posts quarterly loss on lower sugar, fuel sales"
2018-08-13 12:38:00,"Cosan\'s (CZZ) Q2 Net Income Surges 104%, Revenues Up Y/Y"
2018-09-05 12:50:00,What does Cosan Limiteds (NYSE:CZZ) Balance Sheet Tell Us About Its Future?
2018-10-17 11:21:00,Brazils Cosan Is Considering Bid on Uber-Like Truckers Service
2018-10-22 07:25:00,"Consolidated Research: 2018 Summary Expectations for Gol Linhas Aereas Inteligentes S.A, Trupanion, Ecopetrol S.A, Tejon Ranch, Cosan, and Thomson Reuters  Fundamental Analysis, Key Performance Indications"
2018-10-22 12:40:00,Brief Commentary On Cosan Limiteds (NYSE:CZZ) Fundamentals
2018-10-24 08:21:00,Brazil\'s Cosan says it is considering incorporating Cosan Log
2018-11-05 10:52:00,"EMERGING MARKETS-LatAm currencies, stocks gain ahead of U.S. elections"
2018-11-07 04:37:00,Brazil\'s Cosan posts smaller quarterly profit -filing
2018-11-07 05:08:00,Brazil energy firm Cosan reports sharp fall in quarterly profit
2018-11-09 09:10:00,Is Cosan (CZZ) a Great Value Stock Right Now?
2018-11-13 01:38:00,"Cosan\'s (CZZ) Q3 Net Income Drops 28%, Revenues Improve"
2018-11-27 01:48:00,Is Cosan (CZZ) Stock Undervalued Right Now?
2018-11-28 07:58:00,Emerging Markets to Outpace US in 2019: 4 Gainers
2018-11-30 08:08:00,"Cosan Limited Announces Commencement Of Tender Offer To Repurchase Up To U.S.$100,000,000 Of Its Class A Common Shares At Price Not Greater Than U.S.$9.30 Nor Less Than U.S.$8.88 Per Share"
2018-11-30 09:24:00,"EMERGING MARKETS-Mexican peso dips on trade worries, president-elect inauguration"
2018-12-01 05:56:00,6 Undervalued Stocks With Rising Prices
2018-12-03 08:37:00,Why Bunge (BG) Could Be Positioned for a Slump
2018-12-23 12:16:00,Hedge Funds Are Dumping Cosan Limited (CZZ)
2018-12-31 07:00:00,Cosan Limited Announces Preliminary Results Of Its Tender Offer
2019-01-14 06:07:00,"Rising Costs, Adverse Weather to Hit Cosan\'s Performance"
2019-01-25 02:17:00,"With A 6.8% Return On Equity, Is Cosan Limited (NYSE:CZZ) A Quality Stock?"
2019-03-13 02:53:00,Does Cosan Limiteds (NYSE:CZZ) Debt Level Pose A Problem?
2019-03-19 09:24:00,Brazil\'s Ra\xc3\xadzen hedges over 60 pct of sugar sales in 2019/2020 - CEO
2019-04-22 09:21:00,Sugar King Makes Brazil Infrastructure the New Hot Commodity
2019-04-29 05:13:00,Top Sugar Stocks for 2019-2020
2019-04-30 07:01:00,Were Hedge Funds Right About Flocking Into Cosan Limited (CZZ) ?
2019-05-01 07:00:00,Cosan Limited Files 2018 Form 20-F with the U.S. SEC
2019-05-05 04:41:00,Top Alternative Energy Stocks for 2019
2019-05-06 02:30:00,Investors Who Bought Cosan (NYSE:CZZ) Shares Three Years Ago Are Now Up 149%
2019-05-07 04:56:00,Cosan Overseas Limited -- Moody\'s announces completion of a periodic review of ratings of Cosan S.A.
2019-05-08 06:44:00,Cosan S.A. -- Moody\'s affirms Cosan\'s corporate family rating
2019-05-08 06:48:00,Cosan Overseas Limited -- Moody\'s upgrades Cosan\'s notes to Ba2; stable outlook
2019-05-13 07:57:00,Brazil energy group Cosan net income up 14.5% -filing
2019-05-31 09:31:00,Why Is Cosan (CZZ) Up 4.9% Since Last Earnings Report?
2019-06-07 10:00:00,Here\'s Why Cosan (CZZ) is a Great Momentum Stock to Buy
2019-06-11 02:28:00,Are Cosan Limiteds Returns On Capital Worth Investigating?
2019-06-14 09:30:00,Cosan (CZZ) Up 14% Since Last Earnings Report: Can It Continue?
2019-06-16 09:42:00,Top Sugar Stocks for 20192020
2019-06-18 08:53:00,New Strong Buy Stocks for June 18th
2019-06-24 01:53:00,Heres What Hedge Funds Think About Cosan Limited (CZZ)
2019-06-24 08:44:00,New Strong Buy Stocks for June 24th
2019-06-28 09:00:00,Cosan (CZZ) Upgraded to Strong Buy: What Does It Mean for the Stock?
2019-07-03 05:50:00,Cosan (CZZ) Stock Sinks As Market Gains: What You Should Know
2019-07-04 09:30:00,Is Cosan (CZZ) Stock Outpacing Its Basic Materials Peers This Year?
2019-07-11 05:45:00,Cosan (CZZ) Gains But Lags Market: What You Should Know
2019-07-15 05:52:00,"Brazil plan to open gas sector seen luring Naturgy, Engie, others"
2019-07-17 05:50:00,Cosan (CZZ) Stock Moves -0.49%: What You Should Know
2019-07-17 10:35:00,How Does Cosan Limited (NYSE:CZZ) Affect Your Portfolio Volatility?
2019-07-18 10:10:00,New Strong Buy Stocks for July 18th
2019-07-22 09:30:00,Has Cosan (CZZ) Outpaced Other Basic Materials Stocks This Year?
2019-07-29 05:45:00,Cosan (CZZ) Dips More Than Broader Markets: What You Should Know
2019-08-05 09:10:00,Should Value Investors Buy Cosan (CZZ) Stock?
2019-08-13 10:29:00,CORRECTED-Brazil\'s Cosan says JV with Mexico\'s FEMSA to open 500 stores
2019-08-16 10:05:00,Cosan\'s (CZZ) Net Income Improves Y/Y on Solid Sales in Q2
2019-08-19 10:04:00,Does Cosan (NYSE:CZZ) Have A Healthy Balance Sheet?
2019-08-20 12:29:00,Cosan Ltd (CZZ) Q2 2019 Earnings Call Transcript
2019-08-28 07:30:00,"Cosan Limited Announces Commencement Of Tender Offer To Repurchase Up To U.S.$357,500,000 Of Its Class A Common Shares At Price Not Greater Than U.S.$14.10 Nor Less Than U.S.$12.00 Per Share"
2019-09-11 10:38:00,Cosan Could Rally Further With Strong Charts and a Quant Recommendation
2019-09-12 07:00:00,"Cosan Limited Announces The Adjusted Price Range Of Its Tender Offer To Repurchase Up To U.S.$357,500,000 Of Its Class A Common Shares At A Price Not Greater Than U.S.$15.50 Nor Less Than U.S.$13.05 Per Share"
2019-09-16 05:50:00,Cosan (CZZ) Gains As Market Dips: What You Should Know
2019-09-18 07:46:00,Why Cosan Limited (NYSE:CZZ) Looks Like A Quality Company
2019-09-18 08:15:00,New Strong Sell Stocks for September 18th
2019-10-01 05:50:00,Cosan (CZZ) Stock Moves -0.4%: What You Should Know
2019-10-14 09:10:00,Are Investors Undervaluing Cosan (CZZ) Right Now?
2019-10-23 08:12:00,Did Hedge Funds Drop The Ball On Cosan Limited (CZZ)?
2019-10-24 07:25:00,"The Cosan (NYSE:CZZ) Share Price Has Gained 100%, So Why Not Pay It Some Attention?"
2019-10-29 09:09:00,Brazil antitrust agency clears Raizen Energia purchase of Cosan Biomassa
,"Factors of Influence in 2019, Key Indicators and Opportunity within Toyota Motor, UROGEN PHARMA, Macerich, Cosan, Middlesex Water, and Howard Hughes  New Research Emphasizes Economic Growth"
,"The Zacks Analyst Blog Highlights: TIM Participacoes S.A., Cosan, Industrias Bachoco, S.A.B. de C.V., IRSA Inversiones y Representaciones and Vale S.A."
,Buy 5 Low P/CF Stocks to Sail Through Market Volatility
,Buy These 6 Latin America Stocks for Strong Gains in 2018
,Sector Snap: Aventine Leads Ethanol Down
,Sector Snap: Ethanol Stocks Fall on Corn
,5 Must Read Articles in Oil and Alternative Energy
,Sector Snap: Ethanol Makers Climb
,Sector Glance: Ethanol Stocks Decline
,Sector Snap: ADM Leads Ethanol Lower
,Cosan to Acquire ALL Shares
,TEXT-S&P: Cosan to buy 49 pct of America Latina Logistica
,UPDATE 1-Brazil Cosan buys into control of ALL railway
,Energy Common Sense: Codexis Plays the Shell Game With Management
,CZZ Upgraded to Outperform
,Ethanol Production Surging -- Pacific Ethanol and Cosan Limited Begin to Benefit
,Brazil Cosan takes stake in railway operator ALL
,"It\'s the Feedstock, Stupid: Four Feedstock Plays For the Future of Sugar"
,Highbridge Capital Management Holdings in 4th Quarter: 13F Alert
,"Zacks.com featured expert Kevin Matras highlights: UnitedHealth Group Inc., Lowe\'s Companies, Inc., Enterprise Products Partners L.P., Cosan Ltd. and Landstar System, Inc."
,Your Next Stock Should Be Making New Highs
,Fueling Tomorrow: Codexis
,Cosan Reports Upbeat 3Q12 Results
,"UPDATE 1-Better sugar, ethanol prices lift Brazil Cosan net"
,Brazil\'s Cosan sees higher sugar prices ahead
,Brazil Cosan net surges on ethanol export revenues
,The Brazilian Sugarcane Industry\'s Sweet Future
,Q3 2012 Cosan Ltd Earnings Release - After Market Close
,"SOFTS-Sugar, cocoa edge higher, eyes on Greece"
,Rain shield to operate at Brazil sugar berth by Nov
,Brazil\'s Cosan quarterly net profit rises to 686 mln reais
,Top 3 Sugar Stocks for 2018
,Add Value to Your Investment With These 4 Low P/CF Stocks
,5 Best PEG Stocks Value Investors Love
,Top Ranked Value Stocks to Buy for February 1st
,Will New SEC Rules Stop Bears?
,Green Plains Picks Up Ethanol Sector With Impressive Earnings
,Brazilian producers of ethanol agree to merge
,One Stock to Rule the Recession
,Vale in the mix
,Brazilian Ethanol Takes a Hit
,Has Big Oil Finally Gotten Serious About Biofuels?
,These Stocks Are Trash!
,Stratus invests in Amyris\' Brazil biofuel project
,Big Oil vs. Big Ag
,A Sweet Ethanol Deal
,More Good News From the Ethanol Sector
,Shell\'s New Biofuels Bet with Cosan Is Great News for Codexis
,"Hershey Has Kisses, But Kraft and Cadbury Have A Wedding"
,Shell and Cosan JV - an alternative fuels major
,Shelling out for biofuel
,Shell makes good in biofuels promises
,Latin American Markets: Brazil\'s Bovespa gains on Cosan ethanol deal
,Brazil\'s Cosan surges on Shell ethanol venture
,Shell in $12bn Brazilian biofuels partnership
,Q+A-Why are foreign firms betting on Brazilian ethanol?
,Shell eyes U.S. market with Brazilian ethanol
,UPDATE - Shell in $12 bln ethanol deal with Brazil\'s Cosan
,Latin American Markets: Brazil\'s Bovespa led by rallying Cosan shares
,"UPDATE - Shell, Brazil\'s Cosan in $12 billion ethanol deal"
,Cosan shares jump on new Shell joint venture
,"Smart Modular, Cosan: Early Volume Plays"
,"Mergers, takeovers in Brazil\'s ethanol industry"
,"UPDATE - Brazil\'s Cosan, Shell in $12 bln ethanol deal"
,"UPDATE - Brazil Cosan, Shell in $12 bln ethanol merger deal"
,"Brazil Cosan, Shell in $12 bln ethanol merger deal"
,Second-Generation Biofuels Ready To Take Off
,Tully Crushes Bunge\'s Asian Play ... for Now
,The Future of Food Prices: Sugar
