DateTime,News
2009-11-03 05:29:00,Latin American Markets: Vale issues 30-year bonds; Mexico up
2009-11-03 08:33:00,Brazil\'s Billionaire Boom
2009-11-04 04:00:00,"Latin American Markets: Mexico, Brazil extend gains after Fed statement"
2009-11-04 05:37:00,"Latin American Markets: Mexico, Brazil stocks climb after Fed statement"
2009-11-04 05:46:00,"CSN Records Net Income of R$1.15 Billion, Sales Volume Moves up by 39% and the EBITDA Margin Widens to 33% in the 3Q09"
2009-11-04 06:00:00,This Is the Market\'s Cheapest Stock
2009-11-04 08:57:00,"UPDATE - Brazil\'s CSN Q3 profit soars 28-fold, shares rally"
2009-11-06 01:52:00,3 Stocks Hitting High Notes
2009-11-20 05:00:00,Infrastructure ETF Picks Best of BRICs
2009-12-03 07:54:00,What Options are Saying About This Steel Company
2009-12-04 02:24:00,"Latin American Markets: Stocks in Mexico reach new highs, follow U.S. data"
2009-12-04 07:12:00,Latin American Markets: Mexican stocks advance on U.S. jobs hopes
2009-12-11 07:43:00,Peter Brimelow: From \'markets nerd\' to \'flashy promoter\'
2009-12-17 07:17:00,Why Steel Makers Are on an Earnings Watch
2009-12-18 03:42:00,Steelmaker Bids $5.56 Billion for Cement Firm
2009-12-18 04:16:00,UPDATE - Brazil\'s CSN in $5.6 bln bid for Portugal\'s Cimpor
2009-12-18 05:36:00,"CSN says to fund Cimpor takeover with cash, loans"
2009-12-18 05:55:00,Latin American Markets: CSN drags Brazilian stock benchmark lower
2009-12-18 05:57:00,Companhia Siderurgica Nacional bids for Cimpor
2009-12-18 05:59:00,EMERGING MARKETS-LatAm stocks slide for 4th session
2009-12-18 06:15:00,[$$] Brazil\'s CSN Bids $5.53 Billion for Portugal\'s Cimpor
2009-12-18 07:12:00,UPDATE - Brazilian CSN bids $5.6 bln for Portuguese Cimpor
2009-12-18 08:44:00,"Before the Bell: Dana, Micron, Oracle in focus"
2009-12-18 08:45:00,CSN Announces Proposal for the Acquisition of Cimpor
2009-12-18 10:19:00,Brazil\'s CSN bids $5.6 bln for Portugal\'s Cimpor
2009-12-21 02:04:00,SID Bids for Portuguese Company
2009-12-21 12:55:00,UPDATE - Brazil\'s Camargo mum on reports it wants Cimpor stake
2009-12-23 10:05:00,Wilkinson OGrady And Co. Portfolio Manager Chooses International Stock Winners: Which Companies Made The List?
2009-12-28 06:50:00,Top 11 Components of the Dow Jones BRIC Brazil 15 Index
2009-12-30 10:23:00,4-Star Stocks Poised to Pop: CSN
2009-12-31 05:55:00,Top 10 Emerging Markets Metals and Mining Stocks
2009-12-31 11:19:00,10 Global Large Cap Steel Stocks
2010-01-08 01:13:00,"CSN says Cimpor bid aggressive, open to talks-CEO"
2010-01-08 02:17:00,"UPDATE - CSN says Cimpor bid aggressive, open to talks -CEO"
2010-01-08 02:20:00,"Latin American Markets: Brazil stock benchmark gains on Gol, steel shares"
2010-01-08 04:28:00,RPT-UPDATE - Cimpor shares down after rejects CSN takeover bid
2010-01-08 07:03:00,UPDATE - Cimpor shares pare losses on talk of rival bid
2010-01-08 12:52:00,UPDATE - Cimpor shares hold bid premium amid talk of rival bid
2010-01-13 10:02:00,UPDATE - Camargo seeks cement business merger with Cimpor
2010-01-13 11:46:00,UPDATE - Camargo eyes Cimpor cement tie-up in challenge to CSN
2010-01-14 09:27:00,UPDATE - Camargo says no deal or talks with Lafarge on Cimpor
2010-01-20 06:54:00,Latin American Markets: Brazilian stocks hit on Chinese stimulus worries
2010-01-21 02:17:00,Portuguese regulator to probe CGD\'s Cimpor stake
2010-01-26 06:42:00,Latin American Markets: Brazil stocks fall as China worries resurface
2010-01-26 10:05:00,"Brazil\'s Votorantim says made ""conciliatory"" bid for Cimpor"
2010-01-29 01:34:00,UPDATE - Camargo calls off Cimpor merger proposal
2010-01-29 05:28:00,Camargo to withdraw Cimpor merger proposal -report
2010-01-29 06:13:00,"Latin American Markets: Brazil, Mexico stocks finish with monthly losses"
2010-03-03 11:12:00,SID Beats Zacks Consensus
2010-03-04 05:28:00,AK Steel Spikes on Buyout Rumor
2010-03-09 01:33:00,Commercial Metals: Rumored M&A Target
2010-03-09 07:24:00,"Latin American Markets: Mining, home builders fuel stock gains in Brazil"
2010-03-09 08:01:00,CSN to build two cement plants to boost output
2010-03-09 08:38:00,Brazil\'s CSN plans Casa de Pedra IPO by June 30-chairman
2010-03-09 11:04:00,UPDATE - Brazil\'s CSN plans Casa de Pedra IPO by June 30
2010-03-10 06:11:00,Brazilian Steel Company Eyes Some Spinoffs
2010-03-11 03:35:00,Hot Rumors and Forged Deals in Steel
2010-03-11 08:22:00,Latin American Markets: Brazil stocks slip as China rate concerns crop up
2010-03-17 04:46:00,"Companhia Siderurgica Nacional, Abraxis BioScience, Inc.: Biggest Price Gainers (SID, ABII)"
2010-03-17 12:48:00,"Companhia Siderurgica Nacional, Abraxis Bioscience Inc.: Biggest Price Gainers (SID, ABII)"
2010-03-18 07:45:00,Latin American Markets: Brazil index pulled lower as resource stocks slump
2010-03-24 01:04:00,NATIONAL STEEL CO Financials
2010-03-24 01:28:00,The Hottest Thing In Natural Gas: Steel
2010-03-24 08:36:00,Steel And Mining ETFs Outpace S&P
2010-03-29 03:05:00,[$$] Brazil Firms Rebound but Lose Pricing Power
2010-03-29 07:05:00,Latin American Markets: Brazil stock index higher as Vale shares upgraded
2010-03-30 12:11:00,The Technical Indicator: Is a rotation to China the markets\' next move?
2010-03-31 05:01:00,Global Base Metals And Domestic Coal - Jordi Dominguez - HSBC Securities (USA)
2010-04-07 06:20:00,Foreign Steel Makers Reflect World Recovery
2010-04-07 07:03:00,Splits Calendar: Comp Siderurgica splits before market open today (2:1 ratio)
2010-04-14 05:01:00,CSN will raise Brazil steel prices by 7.5 pct
2010-05-03 05:59:00,Latin American Markets: Petrobras falls as share-offer plan progresses
2010-05-04 12:07:00,Comp Siderurgica downgraded by Barclays Capital
2010-05-06 07:07:00,Q1 2010 Companhia Siderurgica Nacional Earnings Release - After Market Close
2010-05-06 10:33:00,"UPDATE - CSN Q1 net income up 31 pct, sales recover"
2010-05-06 10:42:00,CSN: EBITDA Margin Reaches 41% and Gross Profit Stands at R$1.4 Billion in 1Q10
2010-05-07 08:54:00,Brazil steelmaker CSN plans 28.9 mln share buyback
2013-04-30 06:06:00,CSN Announces the Filing of its 2012 Form 20-F
2013-05-09 04:16:00,Big put sale in Brazilian steel maker
2013-05-09 09:01:00,ThyssenKrupp Close to Finally Biting the Bullet
2013-05-15 11:14:00,CSN Announces 1Q13 Results
2013-05-16 02:46:00,Brazil\'s CSN sees its average steel price up over 5 pct in Q2
2013-05-16 08:10:00,CSN Posts Weak 1Q13 Earnings & Rev
2013-05-16 09:29:00,Companhia Siderurgica Nacional Management Discusses Q1 2013 Results - Earnings Call Transcript
2013-05-16 09:48:00,Brazil CSN\'s earnings miss forecasts as iron sales decline
2013-05-17 09:04:00,STXNEWS LATAM-CSN still considering purchase of Thyssen\'s Steel America unit
2013-05-21 08:06:00,Brazil\'s CSN could see Asian partners exit Namisa unit -report
2013-05-29 01:04:00,4 Stocks Underperforming Today In The Metals & Mining Industry
2013-06-03 03:30:00,Will Future Initiatives Be Enough to Boost the Brazilian Iron & Steel Industry?
2013-06-05 05:29:00,Emerging Markets Evening Roundup: Las Vegas Sands Approves Share Buyback; Giant Interactive Plunges
2013-06-05 08:54:00,"ThyssenKrupp may sell Brazilian steel mill to CSN, Reuters reports"
2013-06-06 01:04:00,"SID, GGB, TS And MT, 4 Metals & Mining Stocks Pushing The Industry Lower"
2013-06-06 01:10:00,Neutral Reiterated on CSN
2013-06-06 11:56:00,Invest In These 3 Brazilian Steel Companies
2013-06-07 11:36:00,Brazil: Is S&P\'s Negative Outlook Good News?
2013-06-17 03:44:00,Investors Dump Cos Owned By Brazil Billionaire Batista
2013-07-12 02:00:00,Buy This Coal Miner At A Deep Discount
2013-07-12 11:07:00,Gafisa Drops 3% as New Project Launches Slow
2013-07-22 11:34:00,"HRT Plunges 25% on Dry Oil Well, UBS Downgrade"
2013-08-06 07:10:00,Brazil\'s CSN second-quarter profit above estimates
2013-08-06 07:46:00,CSN Posts Record Steel Revenue and Sales Volume in 1H13
2013-08-07 02:10:00,CSN\'s Q2 Earnings Surpass Est.
2013-08-07 04:46:00,Emerging Markets Evening Roundup: The Love Boat\'s Final Voyage to Turkey; Giant Interactive\'s 9% Plunge
2013-08-07 06:59:00,Companhia Siderurgica Nacional\'s Management Discusses Q2 2013 Results - Earnings Call Transcript
2013-08-07 07:14:00,InPlay: Comp Siderurgica reports 1H13 net rev from steel +21% y/y
2013-08-12 01:45:00,Steel Stocks Jump
2013-08-12 04:02:00,Is it Time to Buy These Beaten Down Brazilian Stocks?
2013-08-14 10:00:00,"Ex-Dividends To Watch: 5 Stocks Going Ex-Dividend Tomorrow: ARDC, PACW, SID, HIW, ABC"
2013-08-15 03:45:00,3 Steals on Steel
2013-08-15 04:16:00,Large put trade in Brazilian steel firm
2013-08-19 01:03:00,5 Stocks Improving Performance Of The Basic Materials Sector
2013-08-26 01:40:00,CSN\'s Neutral Rec Maintained
2013-09-10 04:39:00,Emerging Markets Morning Roundup: Miners and Steel Makers Gain From China; Syria Overhang Recedes
2013-09-11 01:30:00,Strongest Steel Stocks in the Materials Sector
2013-09-11 08:20:00,SID Upgraded to Strong Buy
2013-09-12 10:50:00,Gibraltar Expands Product Offering
2013-09-16 01:30:00,Nucor Lifted to Neutral
2013-09-18 05:18:00,Is the Steel Industry Regaining Its Shine?
2013-09-18 06:26:00,Steel Makers: Second Powerful Advance In Three Months
2013-09-18 12:30:00,ROCK Downgraded to Underperform
2013-09-19 02:00:00,SID Upgraded to Outperform
2013-09-19 02:20:00,Nucor Unveils Q3 View
2013-09-19 08:00:00,AK Steel Holding (AKS) in Focus: Stock Soars 10%
2013-09-20 01:50:00,Mechel Gets Fund Approval for Elga
2013-09-23 01:10:00,Universal Stainless Down to Strong Sell
2013-09-23 01:50:00,AK Steel Down on Weak Q3 View
2013-09-25 11:28:00,Interesting SID Put For November 16th
2013-09-26 01:50:00,Mechel Completes Project Construction
2013-09-30 02:20:00,Nucor Falls on Project Delay
2013-10-01 12:00:00,AK Steel Files Anti-Dumping Case
2013-10-03 03:40:00,USAP Gets Nadcap & ISO 17025 Accreditation
2013-10-03 05:52:00,U.S. Steel Intros ACRYLUME E PLUS
2013-10-07 06:20:00,Valmont Lowered to Neutral
2013-10-08 02:20:00,ArcelorMittal Inks Deal with Sider
2013-10-10 08:20:00,A. M. Castle Slips on Loss Prediction
2013-10-14 05:25:00,Allegheny Lifted to Neutral
2013-10-15 02:30:00,"Allegheny to Restructure, Forecasts Q3 Loss"
2013-10-15 05:04:00,5 Stocks Under $10
2013-10-17 01:45:00,Nucor Beats Estimates in Q3
2013-10-17 04:05:00,Comp Siderurgica upgraded by Standpoint Research
2013-10-17 12:10:00,Mechel Shareholders Approve Guarantee Issue
2013-10-21 05:25:00,Top Stock Picks for the Week of October 21st
2013-10-22 03:50:00,Will Precision Castparts (PCP) Miss Earnings?
2013-10-23 08:30:00,"AK Steel Trims Loss, Outage Hurts Shipment"
2013-10-28 06:00:00,Mechel Inks Elga Financing Deal
2013-10-28 08:40:00,Commercial Metals Rises on Q4 Earnings Beat
2013-10-29 11:43:00,Narrower-than-Expected Loss at U.S. Steel
2013-10-30 06:05:00,AK Steel Wins Patent Infringement Lawsuit
2013-11-01 05:29:00,[video] Fast Money Final Trade
2013-11-01 06:23:00,Your first trade for Monday
2013-11-06 12:55:00,"Foster Beats Q3 Earnings, Misses on Revs"
2013-11-08 02:52:00,Mechel Posts Q3 Operational Results
2013-11-08 05:10:00,AK Steel Hikes Carbon Steel Prices
2013-11-08 12:50:00,Narrower-than-Expected Loss at ArcelorMittal
2013-11-11 04:20:00,U.S. Steel Up on Safety Recognition
2013-11-11 05:05:00,LB Foster Acquires Ball Winch Pipeline
2013-11-11 05:50:00,AK Steel Reaffirmed with Neutral Rec
2013-11-12 01:30:00,Balanced View on U.S. Steel
2013-11-12 06:23:00,"US Steel, AK Steel Lead Steel Stocks On A Hot Roll"
2013-11-14 04:59:00,Companhia Siderurgica Nacional\'s Management Discusses Q3 2013 Results - Earnings Call Transcript
2013-11-14 05:50:00,CSN Posts Record Steel And Mining Revenue In 3Q13
2013-11-14 12:03:00,"CSN, Brazil carmakers in talks for new price hike this year"
2013-11-15 08:20:00,CSN Q3 Earnings Beat Ests
2013-11-18 11:00:00,J.P. Morgan 2014 LatAm Outlook: Returns Will Come From Earnings
2013-11-20 10:00:00,"5 With Upcoming Ex-Dividend Dates: HL, TEN, SID, LTD, LYB"
2013-11-21 01:40:00,Gerdau Maintained at Neutral
2013-11-22 01:40:00,CSN Maintained at Outperform
2013-11-25 05:45:00,AK Steel Raises Stainless Steel Prices
2013-11-26 02:30:00,Mechel Gets Covenant Holidays on Loan
2013-11-27 06:15:00,ArcelorMittal Retains Neutral Rec
2013-12-02 05:50:00,"ArcelorMittal, Nippon Steel Buy TK Steel USA"
2013-12-04 05:54:00,Shiloh Industries (SHLO) in Focus: Stock Moves 5.2% Higher
2013-12-04 08:30:00,AKS Cheers Trade Commission???s Ruling
2013-12-05 05:28:00,Nucor Hikes Quarterly Dividend
2013-12-05 08:10:00,VTB Bank Gives Mechel Covenant Holidays
2014-01-24 03:43:00,These 4 Brazil-Based Stocks Plummeted on Friday
2014-01-27 10:40:00,U.S. Steel Makes Management Changes
2014-01-28 08:40:00,U.S. Steel Beats Q4 Earnings
2014-01-28 12:27:00,"Nucor Beats on Earnings, Revs in Q4"
2014-01-29 01:53:00,"Ghost of 1929 haunts, as 1997-style crisis hits"
2014-01-29 03:04:00,AK Steel Holding (AKS) Jumps: Stock Up 18.7%
2014-01-29 09:00:00,Weak Steel Erodes Earnings at POSCO
2014-01-29 09:20:00,"AK Steel Jumps as Earnings, Sales Beat in Q4"
2014-01-29 10:30:00,"What To Hold: 5 Hold-Rated Dividend Stocks WGL, WIN, FE, BDN, SID"
2014-03-03 09:10:00,Companhia Siderurgica Nacional Loss Plunges in Q4
2014-03-14 01:50:00,Why Companhia Siderurgica Nacional (SID) Is Up Today
2014-03-14 05:16:00,"Why VAALCO Energy, Rigel Pharmaceuticals, and Companhia Siderurgica Nacional Are Today\'s 3 Best Stocks"
2014-03-19 11:30:00,"What To Hold: 3 Hold-Rated Dividend Stocks POT, HTA, SID"
2014-03-25 05:01:00,Fears About Argentina And Mexico Have Ternium Looking Cheap
2014-03-26 02:39:00,Gerdau\'s Correction Seems Overdone
2014-03-28 01:22:00,Updated Research Report on CSN
2014-03-31 11:30:00,"3 Hold-Rated Dividend Stocks: PVR, NYMT, SID"
2014-04-09 01:03:00,3 Stocks Dragging In The Basic Materials Sector
2014-04-14 12:01:00,"Nick Carter, the President and COO of Natural Resource Partners L.P. (NRP), Interviews with The Wall Street Transcript"
2014-04-16 01:28:00,[video] Pisani: Yellen \'clear\' on Fed\'s intentions
2014-04-16 09:46:00,Companhia Siderurgica Nacional (SID) Marked As A Dead Cat Bounce Stock
2014-04-23 10:50:00,AK Steel Posts Wider Loss in Q1
2014-04-24 12:02:00,"Nucor Beats on Q1 Earnings, Revs"
2014-04-25 02:40:00,"POSCO Posts Weak Q1 Earnings, Lowers Outlook"
2014-04-28 05:30:00,ArcelorMittal Slips to Strong Sell
2014-04-29 05:20:00,AK Steel\'s AK Tube Plants Wins Safety Recognition
2014-04-29 09:22:00,"The Zacks Analyst Blog Highlights: Exelon, Ameren, ArcelorMittal, Companhia Siderurgica Nacional and Gerdau"
2014-04-30 05:17:00,CSN Announces The Filing of its 2013 Form 20-F
2014-04-30 05:40:00,Mechel Halts Bluestone Mining Operations
2014-04-30 11:00:00,"U.S. Steel Turns to Profit, but Earnings Miss"
2014-05-07 04:27:00,Companhia Siderurgica Nacional (SID) Q1 2014 Results - Earnings Call Transcript
2014-05-07 08:38:00,CSN Posts Net Revenue of R$4.4 Billion and Adjusted EBITDA Margin of 30% in 1Q14
2014-05-08 02:40:00,Brazil\'s CSN (SID) Q1 Earnings Up
2014-05-13 12:29:00,U.S. Steel: A Bid for Severstal\'s North American Assets?
2014-05-30 11:30:00,"What To Hold: 3 Hold-Rated Dividend Stocks WWE, SID, CLMT"
2014-06-06 09:23:00,Bank Of China Cuts Iron Ore Financing; UBS Cautious On LatAm Materials
2014-06-13 01:03:00,Today\'s Stocks Driving Success For The Metals & Mining Industry
2014-06-13 05:27:00,Election Polls Trump World Cup For Brazilian Investors
2014-06-27 01:03:00,3 Stocks Pulling The Metals & Mining Industry Downward
2014-06-30 04:00:00,Companhia Siderurgica Nacional to Buy Back 27M shares
2014-07-01 11:48:00,UBS: Why Did Vale Regain Momentum?
2014-07-07 01:02:00,3 Stocks Driving The Metals & Mining Industry Higher
2014-07-07 03:22:00,Why Companhia Siderugica Nacion (SID) Stock Is a \'Hold\'
2014-07-08 06:51:00,Companhia Siderurgica Nacional (SID) in Focus: Stock Rises 5.2%
2014-07-09 10:02:00,Is Companhia Siderurgica\'s Dividend Safe for Your Portfolio?
2014-07-11 08:14:00,Companhia Siderurgica Nacional (SID) is Overbought: Is A Drop Coming?
2014-07-16 07:36:00,Companhia Siderurgica Nacional (SID) in Focus: Stock Rises 5.9% in Session
2014-07-18 09:51:00,Today\'s Dead Cat Bounce Stock Is Companhia Siderurgica Nacional (SID)
2014-08-04 09:01:00,CSN Announces 2Q14 Results
2014-08-05 10:30:00,Companhia Siderurgica Nacional Q2 Earnings and Revenue Fall
2014-08-19 06:51:00,Colombia\'s Top Gas Distributor Shows Healthy Debut
2014-08-28 03:32:00,Still Time to Sell Cliffs Natural Resources?
2014-10-27 09:47:00,Today\'s Perilous Reversal Stock: Companhia Siderurgica Nacional (SID)
2014-11-14 06:53:00,CSN announces 3Q14 results
2014-11-14 12:09:00,3 Stocks Dragging The Metals & Mining Industry Downward
2014-11-17 08:30:00,Companhia Siderurgica Posts Q3 Loss on Weak Revenues
2014-12-05 06:40:00,Companhia Siderurgica Nacion (SID) Downgraded From Hold to Sell
2014-12-23 02:55:00,Companhia Siderurgica Nacional (SID) Stock Higher Today as Brent Oil Rises Above $60
2014-12-30 05:30:00,Notice to Shareholders - Payment of Interim Dividends
2015-01-06 11:54:00,Companhia Siderurgica Nacional (SID) Stock Rises Today as Brazilian Iron Ore Exports Climb
2015-01-07 02:52:00,Companhia Siderurgica Nacional (SID) Stock Up Today as Brazilian Iron Ore Exports Climb
2015-03-03 11:13:00,It Might Not Be The Time To Buy Into Steel and Iron
2015-03-09 09:15:00,4Q14 and 2014 Earnings Release Schedule
2015-03-12 07:00:00,CSN announces 4Q14 and 2014 Results
2015-03-12 07:28:00,4Q14 and 2014 Earnings Release
2015-03-12 07:44:00,CSN announces 4Q14 and 2014 results
2015-03-13 09:50:00,Companhia Siderurgica Posts Q4 Earnings as Expenses Fall - Analyst Blog
2015-03-16 03:00:00,"Gerdau Set to Leverage Rising Steel Demand, Runs Risks - Analyst Blog"
2015-03-16 03:10:00,LB Foster Rides on Inorganic Growth Trajectory with IOS Buy - Analyst Blog
2015-03-17 02:20:00,Steel Dynamics (STLD) Repays Senior Notes Due 2020 - Analyst Blog
2015-03-18 11:50:00,Steel Dynamics Sees Lower Q1 Earnings as Shipments Fall - Analyst Blog
2015-03-18 12:00:00,"Valmont (VMI) Faces Challenges in Irrigation, Utility - Analyst Blog"
2015-03-20 12:00:00,"AK Steel Sees Loss in Q1 on Higher Imports, Shares Sag - Analyst Blog"
2015-03-23 02:20:00,Nucor (NUE) Shares Decline 6.4% after Q1 Guidance Cut - Analyst Blog
2015-03-25 08:13:00,Will Companhia Siderurgica (SID) Continue to Surge Higher? - Tale of the Tape
2015-03-27 03:06:00,U.S. Steel Brings Steel Industry Woes to Congresspeople
2015-04-10 10:06:00,Annual and Extraordinary Shareholders\xc2\xb4 Meetings Call Notice
2015-04-11 02:06:00,How the Decline in Steel Production Impacts Steel Companies
2015-04-13 02:50:00,Companhia Siderurgica: Risks Outweigh Growth Prospects - Analyst Blog
2015-04-16 09:30:00,Zacks Rank #5 Additions for Thursday - Tale of the Tape
2015-04-17 10:04:00,An Overview of the Global Steel Industry in April
2015-04-20 04:09:00,Steel Inventories in US Service Centers Decline Slightly in March
2015-04-28 08:51:00,Companhia Siderurgica Nacional (SID) in Focus: Up 9.2% - Tale of the Tape
2015-04-28 10:06:00,Latest Chinese Real Estate Demand Indicators Reflect Slowdown
2015-04-29 10:24:00,CSN Resources S.A. -- Moody\'s downgrades CSN to Ba2; outlook negative
2015-04-30 06:13:00,CSN announces the filing of its 2014 form 20-F
2015-04-30 08:40:00,1Q15 Earnings Release Schedule
2015-04-30 10:01:00,12 Steel Stocks You Should Sell Right Now
2015-05-06 07:59:00,1Q15 Earnings Release
2015-05-06 09:44:00,"Brazil steelmaker CSN posts surprise Q1 profit, shares rise"
2015-05-06 11:11:00,CSN announces 1Q15 results
2015-05-07 01:20:00,"Companhia Siderurgica Q1 Earnings Rise Y/Y, Revenues Fall - Analyst Blog"
2015-05-07 08:48:00,Steel Scrap Prices Moved Sideways in April
2015-05-26 11:56:00,Why an Increase in Housing Starts Is Positive for Steel Investors
2015-06-12 03:00:00,"Companhia Siderurgica Shows Growth Potential, Runs Risks - Analyst Blog"
2015-06-26 06:06:00,Lula Arrest Concerns Trigger Brazil Panic: 5 Biggest Losers - Analyst Blog
2015-07-21 02:16:00,Uh Oh. These Beaten-Down Miners are Joy Global\'s Biggest Customers
2015-08-12 09:55:00,"Vale SA Earnings Q2*, 2015"
2015-08-13 07:52:00,Brazil\'s CSN posts 2nd-qtr loss as mining division struggles
2015-08-13 08:19:00,CSN announces 2Q15 results
2015-08-13 11:34:00,Brazil\'s CSN swings to loss; asset sales to begin soon
2015-08-14 11:00:00,Companhia Siderurgica: Q2 Loss on Soft Sales & High Costs
2015-08-19 12:36:00,Brazil\'s CSN mulls Rothschild or Lazard for asset sales-source
2015-08-26 06:28:00,"Real slump bites Brazil\'s CSN, others despite debt hedging efforts"
2015-08-28 06:33:00,"Brazil Tops World Markets, Even As Q2 GDP Tumbles"
2015-09-03 08:06:00,"CSN cash crunch eases as it refinances 2016, 2017 bank debt"
2015-09-08 02:42:00,Brazil Keeps Rates Unchanged as Real Continues Free Fall
2015-09-09 05:03:00,Brazilian Real Extends Losses as Manufacturing Plunges Deeper
2015-09-16 11:40:00,"Companhia Siderurgica Nacional Earnings Q2, 2015"
2015-09-22 08:14:00,Companhia Siderurgica (SID) Enters Overbought Territory
2015-10-14 06:03:00,How the World Economy Adjusts to Lower Commodity Prices
2015-10-27 03:22:00,"S&P downgrades Brazil\'s steelmaker CSN, keeps outlook negative"
2015-10-30 05:07:00,CSN Resources S.A. -- Moody\'s downgrades CSN to B1; outlook remains negative
2015-11-04 03:09:00,"Brazilian Industry Saw Largest Decline Since 2009, But It\'s Not As Bad As Anticipated"
2015-11-13 03:05:00,Brazil\'s CSN sinks as management fails to assuage debt worries
2015-11-13 07:27:00,CSN announces 3Q15 results
2015-11-13 12:17:00,What Factors Derailed the Steel Industrys Expected 2H15 Recovery?
2015-11-16 10:20:00,Companhia Siderurgica\'s Q3 Loss Widens on Higher Costs
2015-11-21 11:47:00,Is TransAlta Corporation (USA) (TAC) Going to Power These Hedge Funds Returns?
2015-11-27 05:26:00,Hedge Funds Arent Crazy About Companhia Siderurgica Nacional (ADR) (SID) Anymore
2015-12-02 12:09:00,"ArcelorMittal: \'We Knew We Were Early, But Not This Early\'"
2015-12-03 11:00:00,"Companhia Siderurgica Nacional Earnings Q3, 2015"
2015-12-22 03:15:00,Companhia Siderurgica Shows Vital Strength Despite Risks
2016-03-01 08:10:00,Companhia Siderurgica Nacional (SID) Catches Eye: Stock Up 5.6%
2016-03-17 01:54:00,3 Low-priced Stocks Set to Head Higher
2016-03-17 04:08:00,Why Brazilian Industrial Stocks Surged Higher Today
2016-03-17 12:39:00,Is Brazil Economy Bottoming Out?
2016-03-21 05:03:00,4Q15 and 2015 Earnings Release Schedule
2016-03-28 11:27:00,CSN announces 4Q15 and 2015 Results
2016-03-29 10:00:00,Companhia Siderurgica Q4 Net Income Up Y/Y; Sales Down
2016-03-29 12:28:00,CSN announces its 4Q15 results
2016-03-31 08:36:00,New Strong Buy Stocks for March 31st
2016-03-31 11:51:00,Companhia Siderurgica Nacional :SID-US: Earnings Analysis: 2015 By the Numbers
2016-03-31 12:33:00,"Companhia Siderurgica Nacional :SID-US: Earnings Analysis: Q4, 2015 By the Numbers"
2016-04-02 03:49:00,Five Top-Performering Stocks Hedge Funds Overlooked
2016-04-04 03:38:00,"ETFs with exposure to Companhia Siderurgica Nacional : April 4, 2016"
2016-04-04 05:25:00,What Makes Companhia Siderurgica (SID) an Attractive Pick?
2016-04-04 10:21:00,Ride Beaten-Down Shares Up the Wall of Worry: Global Week Ahead
2016-04-05 02:20:00,ArcelorMittal (MT) Completes $3 Billion Rights Issue
2016-04-05 09:30:00,"White Mountains Insurance Group, Bunge, Siderurgica Steel, Konami and AXA SA highlighted as Zacks Bull and Bear of the Day"
2016-04-05 12:30:00,Reliance Steel & Aluminum (RS) Snaps Up Best Manufacturing
2016-04-06 03:06:00,"Brazil\'s CSN gauges sale, partner for Tecon amid debt relief -sources"
2016-04-06 08:05:00,Companhia Siderurgica Nacional (SID) Moves 8.8% Higher
2016-04-07 10:00:00,5 Momentum Stocks to Play on a Strong Uptrend
2016-04-07 11:08:00,5 Stocks Brokers Have Given Up On: Why You Should Not
2016-04-08 09:30:00,"The Zacks Analyst Blog Highlights: GAMCO Investors, Companhia Siderurgica Nacional, NII Holdings, OCI Partners and James Hardie Industries"
2016-04-12 04:24:00,Commodity Sectors Lead the Market\'s Charge
2016-04-13 02:20:00,Heres Why These 5 Stocks Are Grabbing Headlines Today
2016-04-28 01:55:00,5 Stocks Below $10 That Have Crushed the Market
2016-04-28 05:53:00,Brazil\'s Usiminas picks new chairman in rare consensus
2016-05-12 08:52:00,CSN announces 1Q16 results
2016-05-13 05:12:00,Companhia Siderurgica Plunges 13% After Earnings Disappoint Investors
2016-05-13 08:14:00,"Companhia Siderurgica (SID) Slips into Q1 Loss, Sales Weak"
2016-05-13 12:48:00,Why Are These Stocks Deep In Red on Friday?
2016-05-16 02:53:00,"Inflation in Brazil Has Slowed, but the Battle Is Far from Over"
2016-05-25 03:45:00,Chesapeake Energy Corporation (CHK)s Stock Extends Its Rally Into Second Day
2016-05-30 01:04:00,Brazilian Financial Markets in the Aftermath of the 5522 Vote
2016-06-01 02:18:00,"Companhia Siderurgica Nacional :SID-US: Earnings Analysis: Q1, 2016 By the Numbers : June 1, 2016"
2016-06-03 03:40:00,"ETFs with exposure to Companhia Siderurgica Nacional : June 3, 2016"
2016-06-09 04:21:00,Companhia Siderurgica Nacional: Strong price momentum but will it sustain?
2016-06-17 03:42:00,Brazil judge overturns bar on CSN appointees to Usiminas board
2016-06-17 07:07:00,Companhia Siderurgica\'s Future Dim on Micro & Macro Woes
2016-07-19 01:07:00,"ETFs with exposure to Companhia Siderurgica Nacional : July 19, 2016"
2016-08-15 05:54:00,CSN announces 2Q16 results
2016-08-15 06:34:00,Siderurgica Nacional reports 2Q loss
2016-08-16 08:19:00,"Companhia Siderurgica (SID) Q2 Loss Narrows Y/Y, Sales Up"
2016-08-19 08:18:00,Companhia Siderurgica\'s Potential Overshadowed by Risks
2016-09-14 02:45:00,Here\'s Why These Steel Stocks Got Hammered
2016-09-30 08:30:00,Companhia Siderurgica\'s Growth Dimmed by Headwinds
2016-10-05 07:23:00,Brazil\'s CSN says Usiminas shareholder rift is prejudicial to company
2016-11-14 06:41:00,CSN announces 3Q16 results
2016-11-15 08:47:00,"Companhia Siderurgica (SID) Q3 Loss Narrows Y/Y, Sales Up"
