DateTime,News
2016-08-10 09:30:00,"NEW ACTION ALERT: Hagens Berman Alerts Embraer S.A. (NYSE: ERJ) Investors to Securities Class Action and the October 7, 2016 Lead Plaintiff Deadline"
2016-08-10 10:37:00,"SHAREHOLDER ALERT: Levi & Korsinsky, LLP Notifies Shareholders of Embraer S.A. of a Class Action Lawsuit and a Lead Plaintiff Deadline of October 7, 2016  ERJ"
2016-08-10 11:04:00,"Investors sue Embraer in New York, claim stock was inflated"
2016-08-10 11:05:00,IMPORTANT SHAREHOLDER NOTICE: Khang & Khang LLP Announces Securities Class Action Lawsuit against Embraer S.A. and Encourages Investors with Losses to Contact the Firm
2016-08-10 11:19:00,Law Offices of Howard G. Smith Commences Investigation on Behalf of Embraer S.A. Investors
2016-08-10 12:08:00,[$$] Brazils Embraer to Adopt Voluntary Layoff Program
2016-08-10 12:47:00,INVESTOR ALERT: Goldberg Law PC Announces Securities Class Action Lawsuit against Embraer S.A. and Encourages Investors with Losses to Contact the Firm
2016-08-11 04:11:00,"SHAREHOLDER ALERT - Bronstein, Gewirtz & Grossman, LLC Notifies Investors of Class Action Against Embraer S.A. (ERJ) and Lead Plaintiff Deadline: October 7, 2016"
2016-08-11 05:35:00,Ken Fisher Continues to Trade Familiar Stocks
2016-08-11 10:10:00,"SHAREHOLDER ALERT - Bronstein, Gewirtz & Grossman, LLC Reminds Investors of Class Action Against Embraer S.A. (ERJ) and Lead Plaintiff Deadline: October 7, 2016"
2016-08-12 01:42:00,Embraer Sees Tougher Times Ahead
2016-08-12 10:07:00,"EMBRAER SHAREHOLDER ALERT BY FORMER LOUISIANA ATTORNEY GENERAL: Kahn Swick & Foti, LLC Reminds Investors With Losses in Excess of $100,000 of Lead Plaintiff Deadline in Class Action Lawsuit Against Embraer S.A. - ERJ"
2016-08-12 10:12:00,"ERJ SHAREHOLDER ALERT: The Law Offices of Vincent Wong Notifies Investors of Commencement of a Class Action Involving Embraer S.A. and a Lead Plaintiff Deadline of October 7, 2016"
2016-08-12 11:03:00,"SHAREHOLDER ALERT: Rigrodsky & Long, P.A. Announces A Securities Fraud Class Action Lawsuit Has Been Filed Against Embraer S.A. - ERJ"
2016-08-12 11:53:00,SHAREHOLDER NOTICE: Lundin Law PC Announces Securities Class Action Lawsuit against Embraer S.A. and Encourages Investors with Losses to Contact the Firm
2016-08-15 03:45:00,IMPORTANT INVESTOR NOTICE: Khang & Khang LLP Announces Securities Class Action Lawsuit against Embraer S.A. and Encourages Investors with Losses to Contact the Firm
2016-08-16 06:00:00,"INVESTOR ALERT: Brower Piven Encourages Shareholders Who Have Losses In Excess Of $100,000 From Investment In Embraer S.A. To Contact Brower Piven Before The Lead Plaintiff Deadline In Class Action Lawsuit"
2016-08-16 09:42:00,"INVESTOR ALERT: Levi & Korsinsky, LLP Notifies Shareholders of Embraer S.A. of Commencement of a Class Action Lawsuit and a Lead Plaintiff Deadline of October 7, 2016 -- ERJ"
2016-08-17 03:29:00,Glancy Prongay & Murray Announces the Filing of a Securities Class Action on Behalf of Embraer S.A. Investors and Encourages Investors to Contact the Firm
2016-08-17 05:10:00,IMPORTANT SHAREHOLDER NOTICE: Khang & Khang LLP Announces Securities Class Action Lawsuit against Embraer S.A. and Reminds Investors with Losses to Contact the Firm
2016-08-18 03:04:00,Robbins Arroyo LLP: Embraer S.A. (ERJ) Misled Shareholders According to a Recently Filed Class Action
2016-08-18 03:15:00,IMPORTANT SHAREHOLDER ALERT: Lundin Law PC Announces Securities Class Action Lawsuit against Embraer S.A. and Encourages Investors with Losses to Contact the Firm
2016-08-18 11:02:00,SHAREHOLDER NOTICE: Rosen Law Firm Reminds Embraer S.A. Investors of Important Deadline in Class Action - ERJ
2016-08-19 05:23:00,Industrial Metals: Good Bet for the Long Haul?
2016-08-19 10:07:00,"Embraer Shareholder Alert By Former Louisiana Attorney General: Kahn Swick & Foti, LLC Reminds Investors with Losses in Excess of $100,000 of Lead Plaintiff Deadline in Class Action Lawsuit Against Embraer S.A. - ERJ"
2016-08-20 10:13:00,Textron Lands Contract for Texans in Argentina
2016-08-22 06:00:00,EQUITY ALERT: Khang & Khang LLP Announces Securities Class Action Lawsuit against Embraer S.A. and Reminds Investors with Losses to Contact the Firm
2016-08-22 08:17:00,IMPORTANT INVESTOR ALERT: Lundin Law PC Announces Securities Class Action Lawsuit against Embraer S.A. and Encourages Investors with Losses to Contact the Firm
2016-08-22 09:30:00,"Zacks Industry Outlook Highlights: Ford Motor, Alcoa, Boeing, Lockheed Martin and Embraer"
2016-08-22 10:32:00,"INVESTOR ALERT: Levi & Korsinsky, LLP Notifies Shareholders of Embraer S.A. of a Class Action Lawsuit and a Lead Plaintiff Deadline of October 7, 2016 - ERJ"
2016-08-22 12:53:00,SHAREHOLDER ALERT: Pomerantz Law Firm Reminds Shareholders with Losses on their Investment in Embraer S.A. of Class Action Lawsuit and Upcoming Deadline - ERJ
2016-08-23 01:12:00,IMPORTANT SHAREHOLDER ALERT: Khang & Khang LLP Announces Securities Class Action Lawsuit against Embraer S.A. and Reminds Investors with Losses to Contact the Firm
2016-08-23 04:04:00,"Gulfmark Offshore, Embraer in Tuesdays 52-Week Low Club"
2016-08-23 10:14:00,"SHAREHOLDER ALERT: Bronstein, Gewirtz & Grossman, LLC Reminds Investors of Class Action Against Embraer S.A. (ERJ) & Lead Plaintiff Deadline: October 7, 2016"
2016-08-24 06:17:00,Brandes Emerging Markets Value Fund 2nd Quarter Commentary
2016-08-24 06:38:00,Brandes Funds Comments on Embraer
2016-08-24 06:54:00,Brandes Global Equity Fund 2nd Quarter Commentary
2016-08-25 09:30:00,"Hagens Berman Reminds Embraer S.A. (NYSE: ERJ) Investors of the October 7, 2016 Lead Plaintiff Deadline"
2016-08-25 12:10:00,SHAREHOLDER ALERT: Lundin Law PC Announces Securities Class Action Lawsuit against Embraer S.A. and Encourages Investors with Losses to Contact the Firm
2016-08-26 08:00:00,SHAREHOLDER ALERT: Pomerantz Law Firm Reminds Shareholders with Losses on their Investment in Embraer S.A. of Class Action Lawsuit and Upcoming Deadline  ERJ
2016-08-26 09:53:00,"SHAREHOLDER ALERT: Levi & Korsinsky, LLP Reminds Shareholders of Embraer S.A. of a Class Action Lawsuit and a Lead Plaintiff Deadline of October 7, 2016  ERJ"
2016-08-26 11:05:00,IMPORTANT INVESTOR ALERT: Khang & Khang LLP Announces Securities Class Action Lawsuit against Embraer S.A. and Reminds Investors with Losses to Contact the Firm
2016-08-29 05:45:00,INVESTOR ALERT: Lundin Law PC Announces Securities Class Action Lawsuit against Embraer S.A. and Encourages Investors with Losses to Contact the Firm
2016-08-29 07:30:00,"SHAREHOLDER ALERT: Brower Piven Encourages Investors Who Have Losses In Excess Of $100,000 From Investment In Embraer S.A. To Contact Brower Piven Before The Lead Plaintiff Deadline In Class Action Lawsuit  ERJ"
2016-08-29 09:18:00,EQUITY ALERT: Lundin Law PC Announces Securities Class Action Lawsuit against Embraer S.A. and Reminds Investors with Losses to Contact the Firm
2016-08-29 12:21:00,SHAREHOLDER ALERT: Khang & Khang LLP Announces Securities Class Action Lawsuit against Embraer S.A. and Reminds Investors with Losses to Contact the Firm
2016-08-30 08:30:00,The Law Offices of Howard G. Smith Announces the Filing of a Securities Class Action on Behalf of Embraer S.A. Investors and Encourages Investors to Contact the Firm
2016-08-30 11:16:00,INVESTOR ALERT: Khang & Khang LLP Announces Securities Class Action Lawsuit against Embraer S.A. and Reminds Investors with Losses to Contact the Firm
2016-08-31 03:52:00,EQUITY ALERT: Rosen Law Firm Announces Filing of Securities Class Action Lawsuit Against Embraer S.A. - ERJ
2016-08-31 05:57:00,IMPORTANT EQUITY ALERT: Khang & Khang LLP Announces Securities Class Action Lawsuit against Embraer S.A. and Reminds Investors with Losses to Contact the Firm
2016-08-31 09:43:00,"ERJ INVESTOR ALERT: The Law Offices of Vincent Wong Reminds Investors of Commencement of a Class Action Involving Embraer S.A. and a Lead Plaintiff Deadline of October 7, 2016"
2016-08-31 10:15:00,"SHAREHOLDER ALERT: Bronstein, Gewirtz & Grossman, LLC Reminds Investors of Class Action Against Embraer S.A. (ERJ) & Lead Plaintiff Deadline - October 7, 2016"
2016-08-31 11:43:00,IMPORTANT EQUITY ALERT: Lundin Law PC Announces Securities Class Action Lawsuit against Embraer S.A. and Reminds Investors with Losses to Contact the Firm
2016-09-02 08:03:00,Brazil\'s Embraer books five orders from Chinese Colorful Guizhou Airlines
2016-09-02 11:48:00,INVESTOR ALERT: Lundin Law PC Announces Securities Class Action Lawsuit against Embraer S.A. and Reminds Investors with Losses to Contact the Firm
2016-09-05 09:56:00,Embraer (ERJ) Wins $249M Colorful Guizhou Airlines Deal
2016-09-06 02:32:00,Embraers Best Winning Streak in a Decade Pushes Ibovespa Higher
2016-09-06 02:43:00,Embraer sees no impact from engine delays troubling Bombardier
2016-09-06 10:55:00,"ERJ SHAREHOLDER ALERT: The Law Offices of Vincent Wong Reminds Investors of a Class Action Involving Embraer S.A. and a Lead Plaintiff Deadline of October 7, 2016"
2016-09-06 11:47:00,EQUITY ALERT: Khang & Khang LLP Announces Securities Class Action Lawsuit against Embraer S.A. and Encourages Investors with Losses to Contact the Firm
2016-09-07 07:04:00,Why Has 2016 Been Lackluster for OIGAX?
2016-09-08 10:16:00,"SHAREHOLDER ALERT - Bronstein, Gewirtz & Grossman, LLC Reminds Investors of Class Action Against Embraer S.A. (ERJ) & Lead Plaintiff Deadline - October 7, 2016"
2016-09-08 12:15:00,SHAREHOLDER ALERT: Lundin Law PC Announces Securities Class Action Lawsuit against Embraer S.A. and Reminds Investors with Losses to Contact the Firm
2016-09-09 01:20:00,INVESTOR ALERT: Rosen Law Firm Reminds Embraer S.A. Investors of Important October 7 Deadline in Class Action - ERJ
2016-09-09 03:38:00,IMPORTANT INVESTOR ALERT: Khang & Khang LLP Announces Securities Class Action Lawsuit against Embraer S.A. and Encourages Investors with Losses to Contact the Firm
2016-09-09 09:35:00,"INVESTOR ALERT: Levi & Korsinsky, LLP Reminds Shareholders of Embraer S.A. of Commencement of a Class Action Lawsuit and a Lead Plaintiff Deadline of October 7, 2016"
2016-09-11 12:40:00,India Seeks Answers From Embraer on U.S. Investigation
2016-09-11 12:40:00,India Seeks Details From Embraer About U.S. Investigation
2016-09-12 04:54:00,Brower Piven Alerts Shareholders of Upcoming Deadline in Class Action Lawsuit and Encourages Those with Losses from Investment in Embraer S.A. to Contact the Firm
2016-09-12 07:01:00,INVESTOR ALERT: Khang & Khang LLP Announces Securities Class Action Lawsuit against Embraer S.A. and Encourages Investors with Losses to Contact the Firm
2016-09-12 11:32:00,IMPORTANT INVESTOR ALERT: Lundin Law PC Announces Securities Class Action Lawsuit against Embraer S.A. and Reminds Investors with Losses to Contact the Firm
2016-09-13 01:29:00,"ERJ INVESTOR ALERT: The Law Offices of Vincent Wong Notifies Investors of Commencement of a Class Action Involving Embraer S.A. and a Lead Plaintiff Deadline of October 7, 2016"
2016-09-13 02:38:00,IMPORTANT SHAREHOLDER ALERT: Lundin Law PC Announces Securities Class Action Lawsuit against Embraer S.A. and Reminds Investors with Losses to Contact the Firm
2016-09-13 06:20:00,These 5 Stocks Are Breaking Out
2016-09-14 10:17:00,"INVESTOR ALERT - Bronstein, Gewirtz & Grossman, LLC Reminds Investors of Class Action Against Embraer S.A. (ERJ) & Lead Plaintiff Deadline - October 7, 2016"
2016-09-14 12:39:00,IMPORTANT SHAREHOLDER ALERT: Khang & Khang LLP Announces Securities Class Action Lawsuit against Embraer S.A. and Encourages Investors with Losses to Contact the Firm
2016-09-16 10:07:00,"EMBRAER SHAREHOLDER ALERT by Former Louisiana Attorney General: Kahn Swick & Foti, LLC Reminds Investors with Losses in Excess of $100,000 of Lead Plaintiff Deadline in Class Action Lawsuit against Embraer S.A. - ERJ"
2016-09-16 10:49:00,ERJ ALERT: Rosen Law Firm Reminds Embraer S.A. Investors of Important October 7 Deadline in Class Action
2016-09-16 12:41:00,"[$$] Brazil\'s Embraer: 1,470 Employees Subscribe to Voluntary Layoff Program"
2016-09-18 08:18:00,[$$] Business Watch
2016-09-19 02:05:00,"ERJ SHAREHOLDER ALERT: The Law Offices of Vincent Wong Notifies Investors of a Class Action Involving Embraer S.A. and a Lead Plaintiff Deadline of October 7, 2016"
2016-09-20 10:18:00,"DEADLINE ALERT - Bronstein, Gewirtz & Grossman, LLC Reminds Investors of Class Action Against Embraer S.A. (ERJ) & Lead Plaintiff Deadline - October 7, 2016"
2016-09-23 09:48:00,"SHAREHOLDER ALERT: Levi & Korsinsky, LLP Reminds Shareholders of Embraer S.A. of a Class Action Lawsuit and a Lead Plaintiff Deadline of October 7, 2016"
2016-09-23 11:04:00,"DEADLINE ALERT: Rigrodsky & Long, P.A. Reminds Shareholders Of Embraer S.A. Of Upcoming Deadline -- ERJ"
2016-09-26 01:31:00,Brazil\'s Embraer to cut nearly 8 pct of workforce through buyouts
2016-09-26 09:30:00,"EMBRAER INVESTOR REMINDER: Hagens Berman Reminds Embraer S.A. (NYSE: ERJ) Investors of the October 7, 2016 Lead Plaintiff Deadline"
2016-09-27 04:42:00,Deadline Alert: Law Offices of Howard G. Smith Reminds Investors of the Upcoming October 7th Deadline in the Class Action Lawsuit Against Embraer S.A.
2016-09-28 11:24:00,"INVESTOR ALERT: Levi & Korsinsky, LLP Reminds Shareholders of Embraer S.A. of a Class Action Lawsuit and a Lead Plaintiff Deadline of October 7, 2016  ERJ"
2016-09-30 02:28:00,"DEADLINE ALERT: Brower Piven Notifies Shareholders of October 7, 2016 Deadline In Class Action Lawsuit And Encourages Those With Losses In Excess of $100,000 From Investment In Embraer S.A. To Contact The Firm - ERJ"
2016-10-04 02:46:00,GPM Reminds Investors of the October 7th Deadline in the Class Action Lawsuit Against Embraer S.A. and Encourages Investors to Contact the Firm
2016-10-04 04:14:00,"Boeing, Airbus Supplier TransDigm Warns But Special Payout Possible"
2016-10-05 02:07:00,Market Expectations for Textrons 3Q16 Earnings
2016-10-05 04:04:00,NetJets Orders Secure Textron Aviation amid Business Jet Weakness
2016-10-05 10:20:00,"FINAL DEADLINE ALERT - Bronstein, Gewirtz & Grossman, LLC Reminds Investors of Class Action Against Embraer S.A. (ERJ) & Lead Plaintiff Deadline - October 7, 2016"
2016-10-05 10:21:00,"ERJ UPCOMING DEADLINE: The Law Offices of Vincent Wong Reminds Investors of a Class Action Involving Embraer S.A. and a Lead Plaintiff Deadline of October 7, 2016"
2016-10-05 11:27:00,Brazilian planemaker Embraer opens new employee buyout program
2016-10-06 07:41:00,Coverage initiated on Embraer SA by JP Morgan
2016-10-06 07:53:00,Brazil\'s Embraer: still no agreement yet with US authorities in bribery talks
2016-10-06 09:05:00,U.S. graft probe of Brazil\'s Embraer eyes Mozambique deal -report
2016-10-06 10:35:00,"DEADLINE ALERT - Bronstein, Gewirtz & Grossman, LLC Reminds Investors of Class Action Against Embraer S.A. (ERJ) and Lead Plaintiff Deadline: October 7, 2016"
2016-10-06 11:41:00,Embraer says Aercap leases 5 next-generation jets to Turkey\'s Borajet
2016-10-10 11:39:00,"Embraer SA : ERJ-US: Dividend Analysis : September 29th, 2016 (record date) : By the numbers : October 10, 2016"
2016-10-12 07:32:00,Embraer S.A. Announces that it is Seeking to Finalize Settlement Agreements
2016-10-12 09:14:00,"Embraer Nears Deal With U.S., Brazil on Corruption Investigation"
2016-10-12 09:14:00,"Embraer Nears Deal With U.S., Brazil on Corruption Probe"
2016-10-13 02:25:00,Brazil\'s Embraer \'close\' to deal to end US graft case
2016-10-13 05:41:00,Embraer SA upgraded by Goldman
2016-10-13 12:41:00,Brazil\'s Embraer says 180 workers opt for second-round buyout
2016-10-14 01:11:00,Strong commercial jet deliveries lift Embraer shares
2016-10-14 07:54:00,Embraer\'s Commercial Aircraft Deliveries Up 38% in 3Q16
2016-10-17 01:35:00,Embraer Isn\'t Getting Credit for Its Successful Model Changeover
2016-10-17 08:43:00,"Embraer Delivers 54 Jets in Q3, Expects to Meet \'16 View"
2016-10-19 05:29:00,"Brazil Cuts Rate: Stocks Fall, Moody\'s Cites Risk"
2018-07-02 05:36:00,Boeing and Embraer close to final agreement: report
2018-07-04 06:47:00,Brazil air force official defends Boeing-Embraer deal in Congress
2018-07-04 08:59:00,Embraer CEO says talks with Boeing are in final stage: report
2018-07-04 10:21:00,Brazil\'s Embraer Shares Soar on Report of Boeing Deal
2018-07-04 12:09:00,Embraer Jumps on Report Brazil Allows Boeing Deal to Proceed
2018-07-05 01:24:00,[$$] Boeing strikes deal for control of Embraer regional jet operations
2018-07-05 01:25:00,Bombardier Loses Its Edge on Embraer\xc2\xa0After Just Four Days
2018-07-05 01:28:00,Boeing and Embraer Are Forming a Commercial Jet Venture
2018-07-05 01:34:00,Boeing\'s Bargain\xc2\xa0Deal for Embraer Sinks Brazilian Planemaker
2018-07-05 01:34:00,Boeing-Embraer deal could lead to sharp uptick in regional jet orders
2018-07-05 01:44:00,[$$] Embraer shares fall on Boeing deal
2018-07-05 01:50:00,Boeing to buy control of Embraer\'s commercial jet unit
2018-07-05 01:53:00,Should You Buy Boeing (BA) Stock Right Now?
2018-07-05 02:23:00,Embraer\'s stock falls to pace NYSE decliners after JV deal with Boeing
2018-07-05 03:06:00,"Boeing to take over $4.75 billion Embraer unit, targeting Airbus - Bombardier"
2018-07-05 03:26:00,[$$] Boeing Is on the Defensive in Brazil
2018-07-05 03:49:00,Boeing Challenges Airbus With $4.75 Billion Embraer Venture
2018-07-05 04:07:00,Boeing-Embraer Agree On Joint Venture As Boeing Mulls \'797\' Jet
2018-07-05 04:36:00,Boeing and Embraer attempt a joint venture
2018-07-05 04:59:00,"Praxair, Intel rise; Embraer, TiVo fall"
2018-07-05 05:02:00,What Happened in the Stock Market Today
2018-07-05 05:19:00,"Boeing to take over $4.75 billion Embraer unit, targeting Airbus-Bombardier"
2018-07-05 07:00:00,Embraer and Boeing to form commerical aviation company
2018-07-05 07:05:00,Boeing and Embraer to Establish Strategic Aerospace Partnership to Accelerate Global Aerospace Growth
2018-07-05 07:12:00,"Boeing, Embraer Forge $4.75 Billion Commercial Jet Venture"
2018-07-05 07:12:00,Boeing Revs Up Airbus Challenge on $4.75 Billion Embraer Venture
2018-07-05 07:20:00,"Boeing and Embraer to form aerospace JV, with Boeing\'s stake to be valued at $3.8 billion"
2018-07-05 07:21:00,Micron Becomes Entangled in Potential U.S.-China Trade War -- ICYMI
2018-07-05 07:51:00,"Stocks making the biggest moves in the premarket: ERJ, BA, TSLA, NFLX & more"
2018-07-05 08:21:00,EMBRAER S.A.: Boeing and Embraer to Establish Strategic Aerospace Partnership to Accelerate Global Aerospace Growth
2018-07-05 08:41:00,[$$] Boeing to Take Over Embraers Commercial-Jet Business
2018-07-05 08:41:00,[$$] Defense Partnership With Embraer Will Test Brazils Boeing Appetite
2018-07-05 08:42:00,EMBRAER S.A. Material FACT
2018-07-05 09:54:00,Boeing to Take Control of Embraer\'s $4.75 Billion Commercial Business
2018-07-05 10:00:00,Boeing & Embraer Announce Partnership
2018-07-05 10:11:00,Boeing and Embraer Are Forming a $4.75 Billion Commercial Jet Venture
2018-07-05 10:57:00,EMERGING MARKETS-Brazil stocks drop as Embraer deal disappoints
2018-07-05 11:18:00,MARKETS: Boeing moves against Airbus with Embraer joint venture
2018-07-05 11:35:00,Embraer CEO sees $1 billion boost to cash position from Boeing deal - document
2018-07-05 11:36:00,Boeing Goes on the Defensive With Embraer Deal
2018-07-05 11:49:00,Embraer aims for Brazil approval of JV by early November
2018-07-05 12:43:00,[$$] Why Embraer Fell on Boeing News
2018-07-06 05:00:00,Boeings $4.75 Billion Embraer Deal Leaves Long To-Do List
2018-07-06 05:08:00,Boeing to Form a $4.75B Venture With Embraer
2018-07-06 08:07:00,[$$] Airbus Chides Boeing Amid New Rivalry for Smaller Jets
2018-07-06 08:07:00,[$$] Boeing-Embraer Deal Faces Political Backlash in Brazil
2018-07-06 10:20:00,"Boeing, Embraer Sign Commercial Aviation JV Worth $4.8B"
2018-07-06 10:24:00,OPINION: Embraer will be stronger with Boeing than without
2018-07-06 12:02:00,[$$] Boeing deal with Embraer faces political uncertainty
2018-07-07 12:01:00,[$$] Highflying Boeing Lands Thrifty Embraer Deal
2018-07-09 07:05:00,Blog Exposure - Boeing and Embraer Form Strategic Aerospace Partnership
2018-07-09 09:05:00,Going Smaller Makes Boeing Stock a Great Big Buy
2018-07-09 11:15:00,Embraer shareholder files complaint against Boeing deal: paper
2018-07-09 12:07:00,"Boeing Stock Soars on New Zealand Deal, Saudi Arabian Airlines Report"
2018-07-10 02:35:00,"Boeing and Embraer are likely to partner on the 737\'s replacement, analysts say"
2018-07-10 03:05:00,We Still Don\'t Know What Boeing Is Paying for Embraer
2018-07-10 04:19:00,Airbus wins JetBlue order for its newly rebranded A220
2018-07-10 05:23:00,JetBlue agrees to buy at least 60 regional jets from Airbus
2018-07-10 06:39:00,[$$] JetBlue to Order 60 Airbus CSeries Jets
2018-07-10 07:51:00,[$$] The Pressure Is On for Japans First Jetliner
2018-07-10 10:36:00,Brazil development bank chief says Boeing-Embraer is \'good deal\'
2018-07-10 11:15:00,[$$] The Pressure Is On for Japan\'s First Jetliner
2018-07-11 01:14:00,Five things to know about Boeing\'s Embraer deal
2018-07-11 08:10:00,JetBlue Chooses the Airbus A220 to Replace Its Embraer Fleet
2018-07-11 08:54:00,Embraer counts on Brazil\'s public-sector funds to approve Boeing JV: sources
2018-07-12 03:32:00,Brazil development bank head: Embraer won\'t be worth much without Boeing
2018-07-12 09:59:00,Embraer counts on Brazil\'s public-sector funds to approve Boeing JV -sources
2018-07-13 01:16:00,Embraer unions say they get no job protection pledge after Boeing deal
2018-07-15 04:28:00,[$$] Global Trade Spat Unnerves Plane Makers
2018-07-15 07:19:00,"Brazil\'s Embraer sees demand for 10,550 smaller jets in next 20 years"
2018-07-15 09:00:00,FARNBOROUGH: JetBlue decision fails to dent Embraer\'s confidence
2018-07-15 10:18:00,"Embraer pushes E2 jet\'s low maintenance, fuel costs amid Airbus rivalry"
2018-07-16 03:52:00,Boeing\'s United Airlines Dreamliner deal comes in smaller than expected
2018-07-16 07:00:00,"Boeing, Embraer Split $2.3 Billion Aircraft Order From United"
2018-07-16 08:36:00,"Boeing, United announce order for four 787 dreamliners"
2018-07-16 08:46:00,"Embraer Foresees Demand for 10,550 New Aircraft With up to 150 Seats Over the Next 20 years"
2018-07-16 08:50:00,Embraer and United Airlines Sign Contract for 25 E175s
2018-07-16 08:56:00,Brazil\'s Embraer snags $1.1 billion order from United Airlines
2018-07-16 10:23:00,"What\'s not to like? Boeing, Embraer defend planned deal"
2018-07-17 01:05:00,"Embraer, Helvetic Airways Sign Letter of Intent for Up to 24 E2s"
2018-07-17 01:16:00,"Kuwait\'s Wataniya Airways, Signs a Contract for the E195-E2"
2018-07-17 01:28:00,Embraer and Republic Airways Sign Letter of Intent for Up to 200 E175s
2018-07-17 01:29:00,Helvetic Airways to buy a dozen next-gen Embraer jets - filing
2018-07-17 01:39:00,Embraer and Azul Sign a Letter of Intent for Additional E195-E2 jets
2018-07-17 02:27:00,[$$] Airbus Deal Brings Battle With Boeing to Small-Plane Market
2018-07-17 04:06:00,Embraer Signs a Letter of Intent with NAC for Three E190 jets
2018-07-17 09:28:00,"After delays, Japan\'s regional jet faces dogfight with industry giants"
2018-07-17 09:46:00,Embraer to Deliver 25 E175 Jets to United Airlines for $1.1B
2018-07-17 11:49:00,Boeing to seek supplier cost reductions after Embraer deal - CEO
2018-07-17 12:49:00,Embraer and Mauritania Airlines Sign a Contract for Two E175s
2018-07-17 12:52:00,Embraer Signs a Letter of Intent with an Undisclosed Customer from Spain for the E-Jets E2s
2019-01-11 04:41:00,Embraer board OKs next steps on partnership with Boeing - filing
2019-01-11 05:19:00,Boeing Just Cleared The Biggest Hurdle To Takeover Of Top Jet Maker
2019-01-11 05:22:00,"Activision, Vail Resorts fall; General Motors, Embraer rise"
2019-01-14 06:04:00,Embraer says cash position from Boeing deal still to be determined
2019-01-15 07:27:00,Embraer-Boeing Joint Venture Plans Are Moving Forward
2019-01-16 01:26:00,Embraer warns of little or no profit in next two years
2019-01-16 03:47:00,ANALYSIS: Embraer misses 2018 targets but upbeat on E2 sales
2019-01-16 04:43:00,Boeing Just Scored This Multibillion-Dollar Deal With United Airlines
2019-01-16 06:13:00,EMBRAER S.A.: MATERIAL FACT
2019-01-16 07:12:00,"Brazil\'s Embraer sees breakeven in 2019 before interest, taxes"
2019-01-16 09:52:00,EMERGING MARKETS-Brazilian stocks drop on financials; Latam currencies weaken
2019-01-22 07:39:00,Brazil investor group to file lawsuit against Boeing-Embraer deal
2019-01-22 08:40:00,Embraer\'s Guidance Cut Is No Big Deal
2019-01-24 04:57:00,"Embraer signs papers for Boeing tie-up, calls shareholder meeting"
2019-01-24 05:30:00,Embraer S.A. Call Note: Extraordinary General Shareholders\' Meeting
2019-01-24 08:09:00,EMBRAER S.A. - Material Fact
2019-01-25 08:31:00,Deals of the day-Mergers and acquisitions
2019-01-31 04:50:00,Planemaker Embraer signs firm order for 9 E175 jets with SkyWest
2019-01-31 05:20:00,"Embraer and SkyWest, Inc. Sign Contract for Nine E175 Jets"
2019-03-04 01:58:00,"CommutAir plane lands on grass in Presque Isle injuring pilot, 3 passengers"
2019-03-04 05:44:00,"Propeller Airports, Alaska Airlines launch flights from new Paine Field terminal"
2019-03-04 08:52:00,She\'s one in a million and the ideal customer at Paine Field\'s new terminal
2019-03-07 02:29:00,"Kenmore Air may profit after Delta Air Lines cuts flights from Seattle to Victoria, B.C."
2019-03-11 01:48:00,Should You Buy Boeing Stock Amid Turbulence?
2019-03-14 05:39:00,U.S. to upgrade military ties with Brazil during visit next week -sources
2019-03-14 06:00:00,Embraer Earnings Results 4th Quarter and Fiscal Year 2018
2019-03-14 07:46:00,Embraer posts unexpected loss due to charge in executive jet division
2019-03-14 08:36:00,Embraer S.A. (ERJ) Q4 2018 Earnings Conference Call Transcript
2019-03-14 09:40:00,Embraer: 4Q Earnings Snapshot
2019-03-14 12:19:00,Embraer posts loss on executive-jets charge ahead of Boeing deal
