DateTime,News
2009-12-10 02:13:00,5 Stocks Geared for Growth
2009-12-10 02:36:00,Is Brazil Moving Too Fast or Too Slow?
2009-12-10 05:32:00,BRASIL FOODS S.A. Announcement to the Market
2009-12-15 11:53:00,Foreign Stocks You Can Actually Buy: Brazil
2009-12-22 02:49:00,Don\'t Stop Brazil Now
2010-01-06 11:38:00,Quicktake: BRF Brasil Foods
2010-01-11 02:46:00,Nine Foreign Food Sector Stocks
2010-01-13 04:59:00,Zacks #5 Rank Additions for Wednesday
2010-01-14 12:23:00,Is There Any Value Left In Brazil?
2010-01-20 06:54:00,Latin American Markets: Brazilian stocks hit on Chinese stimulus worries
2010-01-27 10:51:00,Bearish MACD for BRF Brasil Foods
2010-03-03 02:49:00,[video] Trading the Globe
2010-03-18 06:41:00,Brazil\'s Bright Future Yields No Stars Today
2010-03-25 11:30:00,Bearish MACD for BRF Brasil
2010-03-25 12:41:00,Volume Talks Wednesday: A Bullish Biotech Breakout Option Play
2010-03-29 05:28:00,Focus List Update: Continuing to Preempt Goldman Sachs and Rest of the Street
2010-03-31 05:22:00,Research In Motion Dives After Hours
2010-04-08 06:22:00,Baidu Builds No Entries During Its Torrid Climb
2010-04-09 07:38:00,Brasil Foods Announces Availability of its 2009 Annual Report
2010-04-29 10:27:00,Hormel (HRL) Given Strong Buy Rating; Company Benefits From Drop In Restaurant Spending By U.S. Public
2010-05-06 08:53:00,Going Net Short in Model Portfolios
2010-05-12 06:35:00,BRF Reports First Quarter Sales of R$ 5.8 Billion
2010-05-12 06:40:00,InPlay: Brasil Foods S.A. reports Q1 net income of R$53 mln vs (R$465 mln) in the same quarter last year; revs fell 1% to R$5.8 bln
2010-05-12 07:07:00,Q1 2010 Brasil Foods S.A. Earnings Release - After Market Close
2010-05-13 10:58:00,Is Now The Time to Buy Brazil?
2010-06-04 01:04:00,BRF-BRASIL FOODS S.A. Financials
2010-06-08 10:53:00,Brazil Is Still A Buy
2010-06-09 06:09:00,Brazil Comes Out Of Recession Swinging
2010-06-11 12:07:00,Emerging Market ADRs Beat U.S. Stocks
2010-06-11 12:07:00,Emerging Market ADRs Outperform U.S. Stocks
2010-06-15 04:22:00,"Rob\'s Wrap: C, BIIB, BRFS, CNQR"
2010-06-17 05:52:00,Lululemon Backs Off; Mellanox Still Basing
2010-06-21 03:31:00,"Ethanol, The Soybean Shift, High-Fructose Corn Syrup And Other Themes From The Agricultural Processing Sector Quarterly Results"
2010-06-22 06:27:00,Tuesday Session Dull After Monday\'s Dents
2010-06-22 08:50:00,It\'s All About China Now
2010-06-23 08:45:00,Top 10 Components of the S&P Global Agribusiness Index
2010-06-28 01:35:00,Halftime Pt. 2: Bullish Signs for Meat Packers?
2010-07-06 02:16:00,Russian Agricultural Machinery Market Is Holy Grail For Sales As Aging Soviet Fleet Finally Gets Replaced: Industry Expert DeMaria Of Sterne Agee Sees Long Term Upside
2010-07-06 02:33:00,Smart Investment Guide to Brazil
2010-07-14 06:27:00,Flurry Of Innovative ETFs Unveiled
2010-08-11 06:58:00,Foreign Stocks Dive On Fresh Look At Fed
2010-08-13 06:06:00,BRF Reports Second Quarter Sales of R$ 6.3 Billion
2011-08-25 04:27:00,Slower Brazil Economy Doesn\'t Stop US Deal Flow
2011-08-29 04:28:00,Commodity-Rich Brazil Offers Investors Many Ways To Profit
2011-08-29 10:23:00,Emerging Market Buy List For Week Of Aug. 29
2011-08-29 11:01:00,"Investors Exiting Agribusiness Stocks -- POT, ADM, BRFS In Focus"
2011-09-01 05:47:00,Big Cap Stocks Reaching 52-Week Highs as Investors Await Unemployment Report
2011-09-02 06:25:00,Brazilian Stocks Show Impact Of Global Woes
2011-09-08 04:57:00,Copa Tries To Fly Even In Market Turbulence
2011-09-12 07:44:00,7 Large Cap Consumer Goods Stocks With Encouraging Receivable Trends
2011-09-20 05:08:00,Brasil Foods in talks to acquire Doux pork assets
2011-09-23 07:51:00,US Overtakes Brazil As World\'s No. 1 Beef Exporter
2011-09-26 06:46:00,"Lightning Round: Arch Coal, Henry Schein, Vodafone and More"
2011-09-26 07:10:00,Lightning Round
2011-09-27 01:49:00,Zacks #1 Rank Additions for Tuesday
2011-09-28 01:32:00,The 9 Top Value-Creating Food and Beverage Companies
2011-09-28 11:14:00,5 Buy And Sell Ideas From Cramer\'s Lightning Round
2011-09-28 11:42:00,The Fastest-Growing Food Stocks
2011-09-28 12:00:00,Cal-Maine Beats 2Q Consensus
2011-09-28 12:57:00,Four Brazilian Stocks To Watch
2011-09-30 05:32:00,World Stocks Screen Switches To Defense
2011-09-30 05:32:00,Short Cattle Supply Bullish For Beef Prices
2011-09-30 07:26:00,Cramer Answers Your Questions
2011-10-03 06:13:00,Brasil Foods buys two Argentine companies
2011-10-03 06:52:00,BRF - Announcement to the Market
2011-10-04 01:03:00,"InPlay: Brasil Foods S.A. acquires the companies Flora Danica S.A, and Flora San Luis for $150 mln"
2011-10-04 05:37:00,Cramer Picks: 3 Buys and 1 Sell
2011-10-08 05:39:00,[$$] Agribusiness Shares Are Ripe for the Picking
2011-10-09 11:30:00,"Farm-equipment, fertilizer stocks are \'ripe\' for the picking, Barron\'s says"
2011-10-13 04:18:00,Market Wrap And 4 Stocks We Are Watching
2011-10-14 03:58:00,Attractive Brazilian Stocks To Consider
2011-10-19 04:43:00,How to Play It: Brazil beckons on awaited rate cut
2011-10-19 06:11:00,UPDATE 1-How to Play It: Brazil beckons on awaited rate cut
2011-10-20 09:06:00,"UPDATE 1-How to Play It: Destination Brazil, lower rates"
2011-10-20 09:09:00,"How to play it: Destination Brazil, lower rates"
2011-10-20 10:12:00,BRF to Host BRF Day in New York
2011-10-20 11:20:00,Has Cosan Become the Perfect Stock?
2011-10-25 11:26:00,Hormel Foods: Free Trade Agreement With South Korea Offers Growth
2011-10-27 06:23:00,BRF - Material Fact
2011-10-27 06:36:00,"Stocks Winning 52-Week Highs as Dow Jones Closes Above 12,200"
2011-10-27 07:16:00,BRF Reports Third Quarter Sales Revenue of R$ 6.3 Billion
2011-10-27 11:12:00,[$$] Favorite Stocks to Feed China\'s Hunger
2011-10-28 01:00:00,"Brazil\'s Rally Broadens: BSBR, GOL, PBR, BRFS All Catch Wind"
2011-10-29 02:37:00,Large Cap Stocks Recording 52-Week Price Highs as S&amp;P 500 Closes Week Up 3.78%
2011-10-29 02:37:00,Large Cap Stocks Recording 52-Week Price Highs as S&P 500 Closes Week Up 3.78%
2011-11-01 07:59:00,The 5 Best And Worst Performing Latin American ADRs- YTD
2011-11-04 01:31:00,"China Mobile, Brazil Foods: Two Emerging BRIC Leaders"
2011-11-08 05:29:00,5 Hot Brazilian Stocks To Watch
2011-11-09 04:07:00,"Brazil Foods, A Great Way To Invest Brazil\'s Booming Economy"
2011-11-11 01:37:00,Russian Trade Tariffs Heading Lower In WTO
2011-11-18 08:05:00,Analytical Reports on BRF - Brasil Foods S.A. and Tyson Foods Inc. - Meat Products Getting a Raw Materials Tailwind
2011-11-22 10:55:00,Brazil\'s Best Buys For Investors
2011-11-29 02:34:00,Put Some Meat on Your Portfolio\'s Bones
2011-12-09 02:11:00,"FUNDVIEW-Thornburg fund likes tech, diversified financials"
2011-12-09 04:27:00,"Mergers and Acquisitions: Blue Coat Systems Spikes into the Green, Icahn Rebuts Commercial Metals Rejection"
2011-12-12 01:00:00,BRF Brasil Foods S.A. (BRFS): Zacks Rank Buy
2011-12-15 05:32:00,BRF - Notice to Shareholders
2011-12-15 08:22:00,10 BRIC Stocks for 2012: SOHU on Top
2011-12-19 10:42:00,Brazil Central Bank Survey Points To Weakening Economy
2011-12-29 08:38:00,Can Brasil Foods Hit Some Impressive Goals?
2011-12-30 04:20:00,Where To Look In Brazil For 2012 Opportunities
2011-12-30 08:00:00,Strong 2Q for Cal-Maine Foods
2011-12-30 12:01:00,How international stock funds could fare in 2012
2011-12-31 11:59:00,How international stock funds could profit in 2012
2012-01-06 03:49:00,Agriculture Sector: Worth Watching
2012-01-09 04:19:00,Hedging 10 Stocks With Institutional Buying And High Projected Growth
2012-01-10 12:01:00,Assessing Latin risk: A year of living dangerously
2012-01-26 10:49:00,5 Big Stocks to Trade for Gains
2012-01-27 10:48:00,Brazil: Investing In A Stable Democracy Growing Exponentially
2012-01-27 12:25:00,This Hidden Gem Is Putting All Its Eggs in One Basket
2012-01-30 12:27:00,Top Value Picks In The BRICs For Week Of Jan. 30
2012-01-31 05:03:00,4 Brazilian Stocks To Watch
2012-03-08 06:35:00,5 Brazilian Stocks for Long-Term Gains
2012-03-14 06:13:00,Brazil Ranks Near Top Of Global Stock Markets
2012-03-15 08:13:00,10 Undervalued Large Caps With Positive Inventory Trends
2012-03-19 10:15:00,Has Hormel Become the Perfect Stock?
2012-03-20 08:10:00,Equity Research on Smithfield Foods Inc. and BRF - Brasil Foods S.A. -- Meat Products Facing Climbing Input Costs
2012-03-20 11:18:00,BRF - Notice of Material Fact
2012-03-22 06:30:00,Brasil Foods Q4 profit down more than expected
2012-03-22 08:32:00,UPDATE 1-Brasil Foods Q4 profit falls more than expected
2012-03-23 02:43:00,3 Brazilian Stocks To Watch
2012-03-23 03:59:00,Brasil Foods Still A Buy
2012-03-26 01:15:00,Brasil Foods Misses Where It Counts
2012-03-28 01:06:00,Brasil Foods - An Emerging Titan With Hefty Expectations
2012-03-28 08:00:00,Cal-Maine Bottom line Lags in 3Q
2012-04-04 09:45:00,BRF is Assigned Investment Grade by the Three Main Rating Agencies
2012-04-18 12:39:00,Investing In Latin American Growth: Choose Consumer Goods And Services
2014-01-21 10:29:00,Largest option trades in equities
2014-03-13 09:29:00,BRF SA Holds Impressive Long-Term Potential
2014-03-18 07:00:00,Tyson Foods Should See Increased Profits On Soaring Pork And Beef Prices
2014-03-19 07:59:00,Carsa S.A. -- Moody\'s downgrades Argentine companies
2014-03-19 09:30:00,4 Ways To Play World Cup Stocks
2014-03-28 06:07:00,"BRF SA (BRFS) is Overbought, What\'s Next?"
2014-04-05 01:04:00,BRF S.A. Financials
2014-04-11 01:02:00,3 Consumer Goods Stocks On The Rise
2014-04-30 04:30:00,BRF S.A. Management Discusses Q1 2014 Results - Earnings Call Transcript
2014-05-01 03:18:00,BRF Still In The Early Stages Of A Major Transformation
2014-05-05 12:00:00,Sysco Misses on Q3 Earnings & Rev
2014-05-06 07:21:00,Tyson Foods (TSN) Crumbles: Stock Slumps by 9.9%
2014-05-07 04:15:00,Pilgrim\'s Pride: A Strong Buy
2014-05-07 06:58:00,Medifast (MED) Falls: Stock Goes Down 7.1%
2014-05-12 06:46:00,Weakness Seen in Post Holdings (POST): Stock Tumbles 7.8%
2014-05-13 07:02:00,Strength Seen in Pinnacle Foods Inc. (PF): Stock Soars 13.2%
2014-05-14 01:02:00,Food & Beverage Stocks On The Rise With Help From 3 Stocks
2014-05-14 06:58:00,Weakness Seen in Elizabeth Arden (RDEN): Stock Plunges 22.8%
2014-05-15 05:50:00,P&G\'s Tide Dry Cleaners Now in Little Rock
2014-05-15 11:51:00,BRF S.A. -- Moody\'s assigns a Baa3 rating to BRF\'s USD 500 million proposed notes; stable outlook
2014-05-21 01:20:00,ConAgra\'s Ardent Mills to Start Production
2014-05-22 01:02:00,3 Consumer Goods Stocks Moving The Sector Upward
2014-05-22 06:42:00,Natural Grocers (NGVC) in Focus: Stock Falls 6.4%
2014-05-27 06:53:00,A. H. Belo (AHC) Falls: Stock Goes Down 0.09%
2014-05-29 06:30:00,"New ""Cheerios Protein"" from General Mills"
2014-05-30 01:02:00,3 Stocks Pushing The Consumer Goods Sector Downward
2014-06-04 01:03:00,3 Food & Beverage Stocks Dragging The Industry Down
2014-06-04 06:20:00,B&G Foods Launches Mac & Cheese Meal
2014-06-05 01:40:00,Smucker Beats on Earnings with Favorable View
2014-06-05 05:51:00,P&G Opens 2nd Tide Dry Cleaners Store in IL
2014-06-06 03:40:00,Carsa S.A. -- Moody\'s repositions Argentine Companies on the revised national scale
2014-06-06 09:57:00,Brazil Anti-Trust Vetoes BRF Minerva Merger
2014-06-06 11:36:00,Brazil Inflation Worsens: BCB Sits On The Sidelines?
2014-06-09 01:03:00,3 Food & Beverage Stocks Pushing Industry Growth
2014-06-09 11:12:00,"Tasty 12.25% Yields For 4 Years From Brasil Foods, Baa3 Rated, Denominated In BRL"
2014-06-10 05:50:00,Balanced View on Sysco Corp.
2014-06-10 08:23:00,Zacks Rank #1 Additions for Tuesday
2014-06-11 08:00:00,"United Natural Misses on Q3 Earnings, Narrows Guidance"
2014-06-12 06:45:00,United Natural Foods Slumps: UNFI Falls 7.6% in Session
2014-06-17 03:30:00,Snyder\'s-Lance Acquires Baptista\'s Bakery
2014-06-18 05:25:00,Campbell Soup Elects Lautenbach in Management Board
2014-06-19 12:50:00,ConAgra Falls on Reduced Outlook for Q4
2014-06-20 04:30:00,Kraft Foods Recalls Velveeta Cheese
2014-06-20 07:10:00,"The Zacks Analyst Blog Highlights: ConAgra Foods, BRF, Hain Celestial Group and Inventure Foods"
2014-06-24 01:03:00,3 Food & Beverage Stocks Moving The Industry Upward
2014-06-25 04:35:00,General Mills Launches Organic Pea Protein Granola
2014-06-26 08:25:00,McCormick Beats on Q2 Earnings; Re-Affirms View
2014-06-26 09:20:00,"ConAgra Misses on Earnings, Beats on Revenues"
2014-06-27 10:50:00,TreeHouse Moves Ahead with Flagstone Acquisition
2014-06-30 09:10:00,ConAgra Completes Boardman Plant Expansion
2014-07-01 05:45:00,United Natural Continues with Cost Containment Efforts
2014-07-16 04:25:00,TreeHouse Expects Q2 Sales Backed by Acquisitions
2014-07-16 04:30:00,United Natural Closes Tony\'s Fine Foods Acquisition
2014-07-17 05:39:00,Smucker Ups Quarterly Dividend by 10%; Rewards Shareholders
2014-07-17 06:51:00,SUPERVALU (SVU) Jumps: Stock Rises 7%
2014-07-17 08:36:00,Zacks Rank #1 Additions for Thursday
2014-07-18 10:00:00,B&G Foods (BGS) Misses Earnings Estimates; Lowers Outlook
2014-07-21 01:02:00,3 Stocks Driving The Consumer Goods Sector Higher
2014-07-29 06:49:00,Brazilian Investors Avenge Germany\'s World Cup Win
2014-07-31 10:40:00,Pilgrim\'s Pride Beats on Q2 Earnings; Misses on Revenues
2014-08-01 01:10:00,L\'Oreal Posts Soft Sales in 1H14 on Adverse Currency Impact
2014-08-01 06:52:00,Kellogg Company (K) Falls: Stock Goes Down 6.1%
2014-08-01 07:11:00,Inventure Foods (SNAK) in Focus: Stock Adds 5.8% in Session
2014-08-05 11:13:00,BRF SA Stock Downgraded (BRFS)
2014-08-07 04:03:00,Carsa S.A. -- Moody\'s changes outlook to negative on Argentine Companies
2014-08-08 01:03:00,3 Stocks Pushing The Food & Beverage Industry Downward
2014-08-10 01:00:00,"Putin\'s European Food Ban Bad For Russia, Good For Brazil"
2014-09-01 03:59:00,Market Reduces Brazil Growth Forecast After Weak 2Q
2014-09-02 01:03:00,3 Stocks Pushing The Food & Beverage Industry Lower
2014-09-05 07:26:00,BRF S.A. -- Moody\'s comments that the announced sale of dairy business unit for BRL 1.8 billion is credit positive for BRF S.A.
2014-09-09 01:04:00,3 Stocks Dragging In The Food & Beverage Industry
2014-09-26 08:54:00,Bank Of America Expects Turnaround To Continue For BRF SA Despite CEO Change
2014-09-26 10:36:00,Quickfood S.A. -- Moody\'s assigns a Baa3 rating to Quickfood\'s new proposed Local Notes.
2014-10-02 08:08:00,Zacks Rank #5 Additions for Thursday
2014-10-06 01:03:00,3 Consumer Goods Stocks Nudging The Sector Higher
2014-10-11 12:01:00,[$$] BRF Bucks Brazilian Malaise
2014-10-14 01:01:00,Brazil Meat Seller BRF: Double-Digit Upside?
2014-10-21 05:48:00,Food-Stock Groups Feature Some Decent EPS Growers
2014-10-22 06:22:00,Brazil Heads To Polls Amid Economic Stagnation
2014-10-22 08:03:00,BRF to Host Investor Day in New York and London
2014-10-23 08:56:00,"What Will Happen Monday, After Brazil Election?"
2014-10-28 09:15:00,Emerging Markets Today: SoftBank Likes India; Brazil Recovering
2014-10-28 10:58:00,Brazil On Sale? ADRs Rally After Rout. Bonds?
2014-11-04 09:12:00,BRF (BRFS) Upgraded From Hold to Buy
2014-11-24 04:28:00,BRF Looks Attractive On Lower M&A Risk: UBS
2014-12-05 06:29:00,Five Top World Stocks With Hot Earnings Estimates
2015-01-14 08:24:00,UPDATE: Miller Tabak Upgrades Brasil Foods On Improved Export Landscape
2015-01-14 08:28:00,Brasil Foods S.A. upgraded by Miller Tabak
2015-01-15 07:50:00,"Emerging Market Outlook 2015: Fed Raises Rates, Brazil Hurts, Mexico\'s OK"
2015-03-02 05:38:00,Announcement to the Market - Public Proxy Solicitation / Electronic Powers of Attorney - 03/02/2015
2015-03-04 11:23:00,Brazil Market Tumbles As Petrobras Probe Proceeds; Rouseff Power Unravels?
2015-03-05 07:40:00,Announcement to the Market - Public Proxy Solicitation -- Amendment - 03/05/2015
2015-03-17 11:34:00,"Brazil Corporate Bonds: Buy Meat Producers, Sell Petrobras?"
2015-03-27 06:57:00,"Some Stocks Unfazed By Bad Week In Argentina, Brazil"
2015-03-27 07:16:00,Brazilian food company draws bulls
2015-03-29 01:49:00,Ford On List Of Companies Suspected Of Brazilian Tax Fraud
2015-03-30 10:09:00,Announcement to the Market - BRF announces the filing of its Form 20-F 2014 - 03/30/2015
2015-03-31 06:06:00,Rising Inflation Fails To Deter Equity Markets in Brazil
2015-03-31 09:44:00,Announcement to the Market - Amendment to the Management Proposal - 03/31/2015
2015-04-01 10:10:00,Petrobras Shares Rise As Rousseff Denies Scandal Knowledge
2015-04-06 05:58:00,"Fast Money Final Trade: BRFS, MSFT, GOOGL & EPI"
2015-04-08 05:07:00,Announcement to the Market - Clarifications about a news article published in the Brazilian Press - 04/08/2015
2015-04-14 12:14:00,"Brazil\'s BRF says focused on new markets in middle East, Asia"
2015-04-16 09:31:00,Announcement to the Market - Joint Venture with SIF from Singapore - 04/16/2015
2015-04-22 09:17:00,Announcement to the Market - Joint Venture between BRF GmbH and IFGL - 04/22/2015
2015-04-22 10:00:00,"Brazil\'s BRF and Invicta enter distribution JV for UK, Scandinavia"
2015-04-22 11:32:00,Brazil regulator clears France\'s Lactalis to buy BRF dairy units
2015-04-28 05:42:00,Management Report - 1Q15 Results - 04/28/2015
2015-04-28 06:12:00,BRF - NET INCOME OF R$462 MILLION IN 1Q15 - 04/28/2015
2015-04-28 09:07:00,BRF S.A. Announcement Regarding the Company\'s Share Buyback Program
2015-04-29 01:51:00,BRF - 1Q15 Results Conference Call Audio - 04/29/2015
2015-04-29 03:06:00,Here\'s The Beef! Brazil\'s BRF Up 8%
2015-04-29 12:51:00,Brasil Foods S.A. upgraded by BofA/Merrill
2015-04-29 12:53:00,BRF Rallies Most Since 2011 as Earnings Show Domestic Resilience
2015-05-04 01:54:00,BRF - 1Q15 Results Conference Call Audio and Transcript - 05/04/2015
2015-05-07 09:16:00,"Tyson Foods, Inc. Earnings Analysis: By the Numbers"
2015-05-25 06:51:00,Bond Markets $80 Billion Green Revolution Gets Brazil Convert
2015-05-29 05:39:00,BRF S.A. -- Moody\'s assigns Baa3 rating to BRF\'s EUR 500 million proposed notes; stable outlook
2015-06-09 07:00:00,5 Foreign Stocks to Trade for Gains
2015-06-10 05:55:00,"As Brazil Inflation Spikes, More Rate Hikes?"
2015-06-17 12:17:00,Rising Inflation Doesnt Deter Equity Markets in Brazil
2015-06-22 01:41:00,Russia Stocks Unfazed As Europe Extends Ukraine Sanctions
2015-06-24 08:52:00,Looking for a Top Growth Stock? 3 Reasons Why BRF S.A. (BRFS) Is an Impressive Choice - Tale of the Tape
2015-07-01 06:40:00,BRF: Material Fact
2015-07-16 11:05:00,Quickfood S.A. -- Rating Action: Moody\'s assigns Baa3/Aaa.ar ratings to Quickfood\'s proposed notes; stable outlook
2015-07-29 09:42:00,Goldman On Brazil: Very Unstable & Getting Worse
2018-04-29 11:37:00,"BRFS INVESTOR ALERT: The Law Offices of Vincent Wong Reminds Investors of a Class Action Involving BRF S.A. and a Lead Plaintiff Deadline of May 11, 2018"
2018-05-01 03:50:00,"PAWAR LAW BRF S.A. Reminder: Important May 11, 2018 Lead Plaintiff Deadline in Class Action- BRFS"
2018-05-01 10:15:00,"SHAREHOLDER ALERT: Bronstein, Gewirtz & Grossman, LLC Reminds Investors of Class Action Against BRF S.A. (BRFS) and Lead Plaintiff Deadline: May 11, 2018"
2018-05-01 10:50:00,"BRF S.A. Shareholder Alert: ClaimsFiler Reminds Investors With Losses In Excess Of $100,000 Of Lead Plaintiff Deadline In Class Action Lawsuit Against BRF S.A. - BRFS"
2018-05-01 12:25:00,"The Klein Law Firm Reminds Investors of Commencement of a Class Action on Behalf of BRF S.A. Shareholders and a Lead Plaintiff Deadline of May 11, 2018 (BRFS)"
2018-05-02 04:15:00,"EQUITY ALERT: Levi & Korsinsky, LLP Reminds Shareholders of BRF S.A. of a Class Action Lawsuit and a Lead Plaintiff Deadline of May 11, 2018"
2018-05-02 08:51:00,BRF Filed its Annual Report on Form 20-F for 2017
2018-05-02 09:08:00,SHAREHOLDER ALERT: Pomerantz Law Firm Reminds Shareholders with Losses on their Investment in BRF S.A. of Class Action Lawsuit and Upcoming Deadline - BRFS
2018-05-02 10:00:00,"FINAL DEADLINE ALERT:\xc2\xa0 Brower Piven Reminds Shareholders Of Approaching Deadline In Class Action Lawsuit And Encourages Those Who Have Losses In Excess Of $100,000 From Investment In BRF S.A. (NYSE: BRFS) To Contact The Firm"
2018-05-02 11:59:00,SHAREHOLDER ALERT: Pomerantz Law Firm Reminds Shareholders with Losses on their Investment in BRF S.A. of Class Action Lawsuit and Upcoming Deadline  BRFS
2018-05-03 03:45:00,"BRFS EQUITY ALERT: The Law Offices of Vincent Wong Reminds Investors of a Class Action Involving BRF S.A. and a Lead Plaintiff Deadline of May 11, 2018"
2018-05-03 05:45:00,Glancy Prongay & Murray LLP Announces the Filing of a Securities Class Action on Behalf of BRF S.A. Investors (BRFS)
2018-05-04 02:35:00,"EQUITY ALERT: Levi & Korsinsky, LLP Reminds Shareholders of BRF S.A. of a Class Action Lawsuit and a Lead Plaintiff Deadline of May 11, 2018 - BRFS"
2018-05-04 10:50:00,"BRF S.A. SHAREHOLDER ALERT: CLAIMSFILER REMINDS INVESTORS WITH LOSSES IN EXCESS OF $100,000 of Lead Plaintiff Deadline in Class Action Lawsuit Against BRF S.A. - BRFS"
2018-05-07 04:10:00,4-Day Deadline Alert: The Schall Law Firm Announces the Filing of a Securities Class Action Lawsuit Against BRF S.A. and Encourages Investors to Contact The Firm
2018-05-07 04:32:00,BRFS INVESTOR ALERT: Law Offices of Howard G. Smith Announces the Filing of a Securities Class Action on Behalf of BRF S.A. Investors
2018-05-08 01:55:00,"INVESTOR ALERT: Levi & Korsinsky, LLP Reminds Shareholders of BRF S.A. of a Class Action Lawsuit and a Lead Plaintiff Deadline of May 11, 2018 - BRFS"
2018-05-08 03:13:00,FRIDAY DEADLINE: The Schall Law Firm Announces the Filing of a Securities Class Action Lawsuit Against BRF S.A. and Encourages Investors to Contact The Firm
2018-05-08 07:23:00,Glancy Prongay & Murray LLP Reminds Investors of the Deadline in the Class Action Lawsuit Against BRF S.A. (BRFS)
2018-05-08 10:50:00,"BRF S.A. 72 HOUR DEADLINE ALERT: Approximately 72 Hours Remain; Former Louisiana Attorney General and Kahn Swick & Foti, LLC Remind Investors of Deadline in Class Action Lawsuit Against BRF S.A. - BRFS"
2018-05-09 02:00:00,"UPCOMING DEADLINE: The Klein Law Firm Reminds Investors of a Class Action on Behalf of BRF S.A. Shareholders and a Lead Plaintiff Deadline of May 11, 2018 (BRFS)"
2018-05-09 11:05:00,2-Day Deadline Alert: The Schall Law Firm Announces the Filing of a Securities Class Action Lawsuit Against BRF S.A. and Encourages Investors to Contact The Firm
2018-05-10 01:45:00,"BRFS DEADLINE TOMORROW: The Law Offices of Vincent Wong Reminds Investors of a Class Action Involving BRF S.A. and a Lead Plaintiff Deadline of May 11, 2018"
2018-05-10 08:25:00,BRF\'s Net Revenue Reaches R$ 8.2 Billion In Q1 2018
2018-05-10 09:13:00,"Brazil\'s BRF loses $32 mln in Q1, misses consensus"
2018-05-10 10:50:00,BRF S.A. 24 HOUR DEADLINE ALERT: Approximately 24 Hours Remain; ClaimsFiler Reminds Investors of Deadline in Class Action Lawsuit Against BRF S.A. - BRFS
2018-05-10 11:45:00,INVESTOR DEADLINE TOMORROW: The Schall Law Firm Announces the Filing of a Securities Class Action Lawsuit Against BRF S.A. and Encourages Investors to Contact The Firm
2018-05-11 07:42:00,BRF: 1Q Earnings Snapshot
2018-05-11 10:34:00,"FINAL DEADLINE ALERT: Bronstein, Gewirtz & Grossman, LLC Reminds Investors of Class Action Against BRF S.A. (BRFS) and Lead Plaintiff Deadline: May 11, 2018"
2018-05-11 10:38:00,"Brazil\'s BRF faces headwinds amid high feed costs, trade bans"
2018-05-11 11:54:00,"DEADLINE TODAY: Levi & Korsinsky, LLP Reminds Shareholders of BRF S.A. of a Class Action Lawsuit and a Lead Plaintiff Deadline of May 11, 2018 - BRFS"
2018-05-11 12:40:00,"Brazil\'s BRF results hit by feed costs, trade bans; shares drop"
2018-05-14 12:05:00,Edited Transcript of BRFS3.SA earnings conference call or presentation 11-May-18 1:00pm GMT
2018-05-16 07:55:00,Free Technical Reports on Tyson Foods and Three Additional Consumer Goods Equities
2018-05-21 06:00:00,Brazils Biggest Pension Fund Turns Into a $50 Billion Activist
2018-06-04 08:45:00,Options Traders Expect Huge Moves in BRF S.A. (BRFS) Stock
2018-06-04 08:49:00,BRF S.A. (BRFS) Surges: Stock Moves 8.3% Higher
2018-06-06 07:18:00,Brazil\'s BRF says unaware of formal process for Minerva tie-up
2018-06-06 11:55:00,EMERGING MARKETS-Brazilian real skids as election worries add to pessimism
2018-06-08 07:00:00,China slaps anti-dumping deposit on Brazilian chicken
2018-06-08 07:55:00,"Research Report Identifies AC Immune SA, Vipshop, Infosys, STMicroelectronics N.V., BRF S.A., and National Steel with Renewed Outlook  Fundamental Analysis, Calculating Forward Movement"
2018-06-13 05:42:00,Former Petrobras CEO Parente invited to lead Brazil\'s BRF -source
2018-06-14 05:25:00,Ex-Petrobras CEO Parente Picked to Run Embattled Food Group BRF
2018-06-14 05:25:00,Ex-Petrobras CEO Picked to Turn Around Brazil Food Giant BRF
2018-06-14 08:09:00,PRESS DIGEST- Financial Times - June 15
2018-06-21 08:13:00,Brazil\'s BRF in talks to sell some Minerva shares -paper
2018-06-21 11:28:00,Brazil chicken exports slump as EU bans weigh
2018-06-29 05:58:00,"Brazil\'s BRF launches restructuring plan, to sell assets in Europe"
2018-06-29 07:21:00,"Brazil\'s BRF announces restructuring, selling Europe, Argentina assets"
2018-06-29 07:30:00,Free Daily Technical Summary Reports on Hormel Foods and Three Other Consumer Goods Stocks
2018-06-29 11:18:00,Brazil\'s BRF expects to reap $130 mln from non-core asset sales
2018-07-02 02:56:00,Why BRF S.A. Stock Popped Today
2018-07-02 05:21:00,"Why Perry Ellis, BRF S.A., and Acxiom Jumped Today"
2018-07-04 08:36:00,Brazil\'s BRF seeks to refinance bank debt -paper
2018-07-10 09:20:00,"Brazil\'s BRF to furlough 1,400 poultry workers for months"
2018-07-16 09:00:00,Brazil\'s BRF hires three banks to advise it on asset sales
2018-08-09 02:45:00,A Preview Of BRF\'s Q2 Earnings
2018-08-10 08:00:00,BRF SA Sponsored ADR to Host Earnings Call
2018-08-10 10:22:00,BRF sees lifting EU chicken ban difficult in short term
2018-08-10 11:19:00,BRF sees potential bidders for \'all\' Argentine assets - CFO
