DateTime,News
2018-08-22 08:25:00,"Investor Expectations to Drive Momentum within Groupon, JetBlue Airways, BRF S.A, INTL FCStone, Oasis Petroleum, and Gorman-Rupp  Discovering Underlying Factors of Influence"
2018-08-29 10:15:00,Edited Transcript of BRFS3.SA earnings conference call or presentation 10-Aug-18 1:00pm GMT
2018-09-03 09:04:00,Brazil\'s BRF names Elcio Ito as CFO -filing
2018-09-11 12:16:00,Brazil fund Previ needs more details to decide on Embraer-Boeing deal -CIO
2018-09-12 04:39:00,Exclusive: Brazil prosecutors seek leniency talks with BRF in food fraud probe
2018-09-19 09:36:00,Brazil\'s BRF sees rising competition for corn from ethanol makers
2018-10-08 02:30:00,"Brazil\'s BRF to conclude asset sales in Dec, tips next CEO"
2018-10-08 08:56:00,"Brazil\'s BRF aims to return to historic margins, cut debt -presentation"
2018-10-08 11:01:00,Brazil\'s BRF CEO Parente says COO Luz to succeed him
2018-10-15 03:50:00,Brazilian police refer ex-BRF executives to prosecutors in food probe
2018-10-17 09:10:00,"Report: Developing Opportunities within Genesis Healthcare, Rexnord, Renewable Energy Group, Aurora Cannabis, Nomad Foods, and BRF S.A  Future Expectations, Projections Moving into 2018"
2018-10-18 08:24:00,Brazilian food firm BRF in talks over leniency deal -newspapers
2018-10-19 07:48:00,Brazil\'s BRF in talks with authorities regarding role in food safety scam
2018-10-19 10:06:00,Brazil\'s BRF says cooperating with authorities in food safety probe
2018-10-25 05:58:00,Brazil agriculture ministry investigates food processor BRF -source
2018-10-25 10:45:00,Brazil agriculture ministry investigates food processor BRF - source
2018-10-26 05:09:00,Brazil begins surprise inspections with 15 meat plants -official
2018-11-08 04:26:00,Analysis: Brazil risks Middle East trade with Israel embassy move
2018-11-08 05:49:00,Brazil\'s BRF reports wider-than-expected Q3 loss
2018-11-08 07:29:00,Brazil\'s BRF reports wider-than-expected Q3 loss in tough turnaround
2018-11-08 09:54:00,Brazil\'s BRF expects binding offers for 3 bln reais of assets next month -executives
2018-11-14 01:14:00,Brazil prosecutors near decision on BRF corruption charges
2018-11-14 07:36:00,"Fundo de Investimento em Direitos Creditorios Clientes BRF -- Moody\'s assigns provisional ratings to senior and mezzanine shares of FIDC Clientes BRF, a Brazilian trade receivables securitization"
2018-11-23 06:59:00,Brazils BRF CEO believes Bolsonaro will ditch Israel embassy move plan
2018-11-24 12:00:00,"Tyson Is Among Would-Be Bidders for BRF Thai, Europe Assets"
2018-11-28 08:45:00,"Report: Developing Opportunities within Costco Wholesale, Pepsico, Northern Oil and Gas, Codexis, Sangamo Therapeutics, and BRF S.A.  Future Expectations, Projections Moving into 2018"
2018-12-07 07:14:00,Brazil\'s BRF sells Argentine Quickfood to Marfrig for $60 mln
2018-12-09 08:20:00,Echostar Corporation (SATS): Are Hedge Funds Right About This Stock?
2018-12-11 12:27:00,Edited Transcript of BRFS3.SA earnings conference call or presentation 8-Nov-18 12:00pm GMT
2018-12-14 05:47:00,"Fundo de Investimento em Direitos Creditorios Clientes BRF -- Moody\'s assigns definitive ratings to senior and mezzanine shares of FIDC Clientes BRF, a Brazilian trade receivables securitization"
2018-12-19 05:41:00,Brazil food producer BRF sells Argentine chicken plant
2018-12-23 11:17:00,Here is What Hedge Funds Think About BRF Brasil Foods SA (BRFS)
2019-01-09 06:57:00,Quickfood S.A. -- Moody\xc2\xb4s downgrades Quickfood S.A.\'s guaranteed notes\xc2\xb4 to B2/A2.ar
2019-01-09 08:37:00,BRF S.A. (BRFS) in Focus: Stock Moves 7.8% Higher
2019-01-18 02:09:00,"Brazil shifting to self-monitoring of food, meat plants -minister"
2019-01-21 11:31:00,Exclusive: China accepts Brazil chicken exporters\' offer to end anti-dumping case
2019-01-23 06:53:00,Brazilian poultry firm BRF aims to restore Saudi exports in three months
2019-03-04 11:58:00,Edited Transcript of BRFS3.SA earnings conference call or presentation 28-Feb-19 1:00pm GMT
2019-03-28 07:44:00,Board of Brazil\'s BRF elects Luz as new CEO -filing
2019-04-03 11:17:00,Top Ranked Momentum Stocks to Buy for April 3rd
2019-04-23 03:44:00,Is BRF S.A. (BRFS) A Good Stock To Buy According To Hedgies?
2019-04-29 09:38:00,BRF Filed its Annual Report on Form 20-F for 2018
2019-05-08 10:00:00,Here\'s Why BRF (BRFS) is a Great Momentum Stock to Buy
2019-05-09 01:44:00,Don\'t Be Afraid to Invest in Emerging-Markets Stocks
2019-05-10 07:27:00,Why BRF S.A. Stock Climbed 37.1% in April
2019-05-10 08:32:00,Brazil\'s BRF posts third consecutive quarterly loss
2019-05-10 10:01:00,BRF seeks China authorization for 4 meat plants to export
2019-05-10 11:11:00,"EMERGING MARKETS-Latam stocks slide on trade jitters, currencies mixed"
2019-05-10 11:25:00,Brazil\'s BRF still seeking partners in Saudi Arabia
2019-05-22 01:20:00,Brazil bans labs from food inspections after BRF scandal
2019-05-22 05:49:00,Brazil bans Merieux labs from food inspections after meatpacker BRF scandal
2019-05-24 11:51:00,Edited Transcript of BRFS3.SA earnings conference call or presentation 10-May-19 1:00pm GMT
2019-05-27 10:00:00,Here\'s Why Momentum Investors Will Love BRF (BRFS)
2019-05-30 05:54:00,Brazil meat companies BRF and Marfrig agree to discuss merger -filing
2019-05-30 06:51:00,Brazil meatpackers BRF and Marfrig enter tie-up talks
2019-05-30 08:34:00,Brazil\'s BRF and Marfrig in talks to form meatpacking heavyweight
2019-05-31 06:19:00,Deals of the day-Mergers and acquisitions
2019-05-31 07:55:00,BRF and Marfrig Begin Talks to Form New Global Meat Giant
2019-06-04 03:28:00,Marfrig Global Foods S.A. -- Moody\'s says potential merger between Marfrig and BRF is credit positive
2019-06-04 06:00:00,BRF board minority resisted merger talks with Marfrig -sources
2019-06-07 09:19:00,Brazil May chicken exports to China rise close to 50% amid ASF outbreak
2019-06-10 05:27:00,"Investors Ignore Analyst Warnings, Pile into BYND Stock"
2019-06-19 04:14:00,Meat-loving Brazil joins the search for plant-based alternatives
2019-06-28 05:24:00,Did Hedge Funds Drop The Ball On BRF S.A. (BRFS) ?
2019-07-04 12:40:00,Quickfood S.A. -- Moody\'s upgrades Quickfood\'s guaranteed notes ratings to B1/Aa3.ar; stable outlook
2019-07-05 11:24:00,Deal Skepticism Unleashes World-Beating Meat Rally for BRF
2019-07-11 07:30:00,"UPDATE 3-Brazil meatpackers BRF, Marfrig call off talks on proposed tie-up"
2019-07-18 06:01:00,"Chicken Giant BRF Still Sees Beef on Deals Menu, CEO Says"
2019-08-01 05:48:00,"Beyond Meat Has a Good Problem, Too Bad Investors Don\'t Like It"
2019-08-05 08:01:00,"Hunger For Tyson Expected to Grow, Say Analysts"
2019-08-09 10:55:00,Brazil\'s BRF to reopen Carambe\xc3\xad plant serving Middle East in September
2019-08-15 01:44:00,Edited Transcript of BRFS3.SA earnings conference call or presentation 9-Aug-19 1:00pm GMT
2019-08-20 01:52:00,"BFF International, Ltd. -- Moody\'s announces completion of a periodic review of ratings of BRF S.A."
2019-08-21 04:46:00,Quickfood S.A. -- Moody\'s announces completion of a periodic review of ratings of Quickfood S.A.
2019-08-21 09:38:00,New Strong Buy Stocks for August 21st
2019-09-03 08:58:00,Quickfood S.A. -- Moody\'s downgrades Argentine companies ; places ratings under review for downgrade
2019-09-06 02:30:00,4 Food Retailers with Bite
2019-09-09 11:24:00,"The Zacks Analyst Blog Highlights: BRF, J &amp; J Snack Foods, Beyond Meat and MGP"
2019-09-11 03:47:00,BRF S.A. -- Moody\'s assigns Ba2 ratings to BRF proposed notes; negative outlook
2019-09-11 08:23:00,"BRF announces cash tender offers for its 5.875% Senior Notes due 2022, 2.750% Senior Notes due 2022, 3.95% Senior Notes due 2023 and 4.75% Senior Notes due 2024"
2019-09-19 07:36:00,BRF announces increase in the Maximum Amount of its cash tender offer for its 4.75% Senior Notes due 2024
2019-09-19 08:24:00,"BRF announces expiration and final results of its cash tender offers for its 5.875% Senior Notes due 2022, 2.750% Senior Notes due 2022 and 3.95% Senior Notes due 2023"
2019-09-24 10:09:00,BRF announces early tender date results of its cash tender offers for its 4.75% Senior Notes due 2024
2019-10-01 08:33:00,Brazil meatpacker admits to bribing food inspectors -court document
2019-10-01 09:47:00,Brazil police say BRF itself not targeted in latest bribery probe
2019-10-01 09:50:00,"UPDATE 3-Brazil meatpacker BRF admits to bribing inspectors with money, benefits"
2019-10-01 11:23:00,Brazil ministry says food inspections overhauled after corruption probe
2019-10-01 11:53:00,Brazil\'s BRF says no offices targeted in the latest phase of a police food probe
2019-10-09 07:55:00,BRF announces expiration and final results of its cash tender offer for its 4.75% Senior Notes due 2024
2019-10-09 08:40:00,"Brazil\'s BRF reports audit of Abu Dhabi plant, says Gulf region still supplied"
2019-10-09 12:14:00,UPDATE 1-Brazil\'s BRF maintains Gulf meat supply despite Abu Dhabi plant audit
2019-10-15 12:38:00,Were Hedge Funds Right About Flocking Into BRF Brasil Foods SA (BRFS) ?
2019-10-21 08:53:00,New Strong Buy Stocks for October 21st
2019-10-29 03:16:00,Investors Can Find Strong Stocks with our First Profit Screen
2019-10-29 07:46:00,Brazilian food processor BRF signs MOU to invest $120M in Saudi plant
2019-10-29 08:46:00,UPDATE 3-Brazil\'s BRF to invest $120 mln in Saudi chicken processing plant
2019-10-30 03:23:00,5 Top-Ranked Cheap Stocks Trading Under $20 to Buy Right Now
2019-10-31 11:41:00,"The Zacks Analyst Blog Highlights: BRF, Hewlett Packard, Luckin Coffee, Cronos Group and Pure Storage"
2019-11-08 09:17:00,BRF\'s Saudi plant to help country produce 60% of its chicken locally
,BRF - 2014 Results Conference Call Audio - 02/27/2015
,Brazil: Rousseff Impeachment Debate Fueled By March Demonstrations
,Management Report - 4Q14 Results - 02/26/2015
,"BRF - net income increases 109.4%, reaching R$2.2 billion in 2014 - 02/26/2015"
,"Today\'s Top 5 Stock Picks: Big, Undervalued Firms"
,Petrobras Sinks On CEO Rumors; Announcement After 2 p.m. EST?
,Brasil Foods Announces 2009 Results
,Santander Brasil Hits Economic Sweet Spot
,Brazilian Homebuilder Turning Itself Around
,Brazil Foods Thrives As Middle Class Blossoms
,Latin American Markets: Brazil stocks hurt by global growth worries
,[$$] Fitz Bits: IBM Is Firming Up
,Is This a Dead Stock Walking?
,4 Stocks to Hold Until Next Leap Year: CEO
,4 Stocks to Buy and Hold Until Next Leap Year: CEO
,[video] 4 Plays for the Next 4 Years
,BRF: Notice of Material Fact
,"Upside Is Not Worth The Risk For Bunge, ADM"
,"Brazil\'s BRF 2018 loss tops $1 bln as trade bans, weak economy weigh"
,Brazil\'s BRF posts wider-than-expected Q4 net lost of $569 mln - filing
,"M\xc3\xa9rieux, BRF lab woes are new blow amid Brazilian food fraud probe"
,EMERGING MARKETS-Brazil\'s real buoyed by pension reform proposal; stocks dip
,Exclusive: Brazil prosecutor seeks BRF food fraud case files from agriculture ministry
,"Tyson Foods, Inc. -- Moody\'s assigns Baa2 ratings to Tyson\'s $2.8 billion of new notes"
,Brazil\'s BRF recalls chicken export products over salmonella fears
,Brazil BRF chicken recall affects nine export markets - spokeswoman
,Brazil\'s BRF recalls fresh chicken meat from Dourados unit - filing
,BRF S.A. -- Moody\'s says BRF\'s asset sales will support deleveraging plan
,Shares of Brazil\'s BRF dive as cash-raising effort falls short
,Brazil\'s BRF rules out additional asset sales -CEO
,"Brazilian chicken exporter BRF sells units to Tyson, postpones debt reduction"
,BRF S.A. Management Discusses Q4 2013 Results - Earnings Call Transcript
,Brazil\'s BRF expects stable investments in 2014
,Brazil\'s BRF to invest $646 million in 2014
,Quickfood S.A. -- Moody\'s: no ratings impact from Quickfood\'s planned add-on new Local Notes issuance
,Piper Jaffray Cuts High-Profile Stocks From Model Portfolio
