DateTime,News
2017-08-01 06:30:00,Netshoes (Cayman) Ltd. Announces Date for Second Quarter 2017 Earnings Release and Conference Call
2017-08-08 08:39:00,"Netshoes (Cayman) Ltd. breached its 50 day moving average in a Bullish Manner : NETS-US : August 8, 2017"
2017-08-14 04:20:00,Netshoes Limited Reports Second Quarter 2017 Results
2017-11-10 11:47:00,Netshoes (Cayman) Ltd. Announces Date for Third Quarter 2017 Earnings Release and Conference Call
2017-11-13 05:00:00,Netshoes Limited Reports Third Quarter 2017 Results
2017-11-16 10:24:00,INVESTOR ALERT: Investigation of Netshoes Announced by Holzer & Holzer
2017-12-12 08:41:00,Falling Earnings Estimates Signal Weakness Ahead for Netshoes (NETS)
2018-03-02 08:11:00,Should Netshoes (Cayman) Limiteds (NYSE:NETS) Recent Earnings Decline Worry You?
2018-03-13 02:48:00,Netshoes (Cayman) Ltd. Announces Date for Fourth Quarter and Full Year 2017 Earnings Release and Conference Call
2018-03-28 05:57:00,"Netshoes Limited Announces Full Year Invoiced Orders Growth of 20%, FY-2017 GMV Growth of 17% or 11% in 4Q-2017 and FY-2017 Net Sales Growth of 9% or 2% in 4Q-2017 Year-over-Year"
2018-03-29 08:18:00,Netshoes (Cayman) Limited: Filing of 2017 Annual Report on Form 20-F
2018-05-08 03:58:00,Netshoes (Cayman) Ltd. Announces Date for First Quarter 2018 Earnings Release and Conference Call
2018-05-14 05:02:00,Netshoes Limited Announces First Quarter 2018 Results
2018-05-16 02:02:00,"Netshoes\' stock plummets again, after J.P. Morgan swings to bearish from bullish"
2018-05-22 04:58:00,"SHAREHOLDER ALERT: Levi & Korsinsky, LLP Notifies Investors of an Investigation Involving Possible Securities Fraud Violations by the Board of Directors of Netshoes (Cayman) Limited"
2018-05-24 09:23:00,INVESTOR ALERT: Kaplan Fox Announces Investigation Of Netshoes (Cayman) Limited
2018-06-08 07:30:00,RM LAW Announces Investigation of Netshoes (Cayman) Limited
2018-06-21 10:13:00,"INVESTOR ALERT: Levi & Korsinsky, LLP Reminds Investors of an Investigation Involving Possible Securities Fraud Violations by the Board of Directors of Netshoes (Cayman) Limited"
2018-07-12 06:11:00,"Bragar Eagel & Squire, P.C. is Investigating Netshoes (Cayman) Limited (NETS) on Behalf of Stockholders and Encourages Investors to Contact the Firm"
2018-08-02 02:43:00,Netshoes (Cayman) Ltd. Announces Date for Second Quarter 2018 Earnings Release and Conference Call
2018-08-02 12:51:00,"Lifshitz & Miller LLP Announces Investigation of Education Realty Trust, Inc., Flex Pharma, Inc. (FLKS), Netshoes (Cayman) Limited, Northwest Bancorporation, Inc., Pinnacle Foods, Inc., Restoration Robotics, Inc., Unum Group and Xerium Technologies, Inc."
2018-08-09 04:54:00,Netshoes Limited Announces Second Quarter 2018 Results
2018-08-10 06:30:00,Netshoes (Cayman) Limited to Host Earnings Call
2018-08-10 09:45:00,Are Netshoes (Cayman) Limiteds (NYSE:NETS) Interest Costs Too High?
2018-08-20 04:08:00,Robbins Arroyo LLP: Netshoes (Cayman) Limited (NETS) Misled Shareholders According to a Recently Filed Class Action
2018-08-21 02:00:00,"INVESTIGATION ALERT: The Schall Law Firm Announces it is Investigating Claims Against Netshoes (Cayman) Limited and Encourages Investors with Losses in Excess of $100,000 to Contact the Firm"
2018-08-21 12:12:00,EQUITY ALERT: Rosen Law Firm Announces Investigation of Securities Claims Against Netshoes (Cayman) Limited
2018-08-21 12:40:00,"SHAREHOLDER ALERT: Bronstein, Gewirtz & Grossman, LLC Announces Investigation of Netshoes (Cayman) Limited (NETS)"
2018-08-24 03:04:00,Investor Alert: Kaplan Fox Continues Investigation Of Netshoes (Cayman) Limited
2018-08-24 06:34:00,Brazil\'s Netshoes working with Goldman Sachs to find partner -sources
2018-08-31 06:40:00,"Stull, Stull & Brody Announces Class Action Suit on Behalf of Purchasers of the Securities of Netshoes (Cayman) Limited (NYSE: NETS)"
2018-09-24 11:37:00,RM LAW Announces Class Action Lawsuit Against Netshoes (Cayman) Limited
2018-09-27 08:30:00,INVESTOR ALERT: Kaskela Law LLC Announces Investigation of Netshoes (Cayman) Limited - NETS
2018-10-02 01:08:00,IMPORTANT INVESTOR ALERT: The Schall Law Firm Announces it is Investigating Claims Against Netshoes (Cayman) Limited and Encourages Investors with Losses to Contact the Firm
2018-11-05 10:30:00,NETSHOES CAYMAN (NETS) May Report Negative Earnings: Know the Trend Ahead of Next Week\'s Release
2018-11-08 01:19:00,Netshoes (Cayman) Ltd. Announces Date for Third Quarter 2018 Earnings Release and Conference Call
2018-11-13 05:09:00,Netshoes (Cayman) Ltd.: Third Quarter 2018 Results
2018-12-04 02:26:00,"ONGOING INVESTIGATION ALERT: The Schall Law Firm Announces it is Investigating Claims Against Netshoes (Cayman) Limited and Encourages Investors with Losses in Excess of $100,000 to Contact the Firm"
2019-04-11 09:07:00,Brazil\'s B2W and Magazine Luiza considering acquisition of Netshoes
2019-04-17 12:07:00,Those Who Purchased Netshoes (Cayman) (NYSE:NETS) Shares A Year Ago Have A 60% Loss To Show For It
2019-04-29 05:39:00,Brazil\'s Magazine Luiza agrees to buy retailer Netshoes for $62 million
2019-04-30 09:15:00,Netshoes (Cayman) Limited: Filing of 2018 Annual Report on Form 20-F
2019-05-23 06:52:00,Netshoes Announces Receipt of Unsolicited Proposal from Grupo SBF S.A.
2019-05-23 07:35:00,Brazil\'s SBF Group makes counteroffer for Netshoes
2019-05-26 06:48:00,Netshoes Announces Amendment to the Merger Agreement with Magazine Luiza
2019-05-29 07:58:00,Brazil retailer Grupo SBF again raises offer for Netshoes
,What Kind Of Shareholder Owns Most Netshoes (Cayman) Limited (NYSE:NETS) Stock?
